gt,hyp
then lakkha singh took the lead in singing the bhajans وقالت الشرطة إن الجثة بدت وكأنها كانت هناك منذ يوم تقريبا , وقالت الشرطة إن الجثة بدت وكأنها كانت هناك منذ يوم تقريبا 
the major religion in moldova is orthodox christian بإمكانك أن ترى الأهرام في الظلام وفي صمت قبل أن يبدأ العرض, بإمكانك أن ترى الأهرام في الظلام وفي صمت قبل أن يبدأ العرض
the east african islands are in the indian ocean off the eastern coast of africa بعدها أخذ لاكها سينغ زمام المبادرة لغناء الباجانز,the east african islands are in the indian ocean off the eastern coast of africaبعدها أخذ لكها سينغزمام المبادرة لغناء الباجانز
as soon as you get out of the current swimming back is no more difficult than normally يستقبل القمر الصناعي بالفضاء المكالمة ثم يعكسها في نفس اللحظة تقريبا ,as soon as you get out of the current snoring back is no more difficult than normally يستقبل القمر الصناعي بالفضاء المكالمه ثم يعكسها في نفس اللحظة تقريبا 
it s worth half an hour to stroll about the intriguing village لقد زار المريض نيجيريا حيث س جلت بعض حالات الإصابة بفيروس إيبولا,لقت زور المريض نيجيريا حيث سجلت بعض حالات الإصابة فيروس إيبولا
it had been scheduled to be cut down on tuesday but was saved after an emergency court ruling رح ب الرئيس الأمريكي جورج دبليو بوش بالإعلان, رحب الرئيس الأمريكي جورج دابليو بوش بالإعلان
the first cases of the disease this season were reported in late july يستحق الأمر نصف ساعة من التجو ل في القرية المثيرة للاهتمام, يستحق الأمر نصف ساعة من التجول في القرية المسيرة للاهتمام
although three people were inside the house when the car impacted it none of them were hurt قال إنه صنع جرس باب يعمل بتقنية واي فاي,قال إنه صنع جرس باب يعمل بتقنيت وايفاي
in the churchyard there are interesting marble sculptures of doves over some tombs كانت معظم حياة العائلة العبرية في الهواء الطلق, كانت معظم حياة العائلة العبرية في الهواء الطلق
the satellite in space gets the call and then reflects it back down almost instantly قال إنه صنع جرس باب يعمل بتقنية واي فاي, ساتلاليت ومحر يصنع باب تقنيه وايفا
soon officers equipped with riot gear entered the yard and cornered the inmates with tear gas لم تكن هناك غابات كبيرة في أرض كنعان لذلك كان الخشب باهظ الثمن,لم تكن هناك غابات كبيرة في أرض كانعان لذلك كان الخشب بوهز السمن
scientists say the explosion caused by the collision was massive بإمكانك أن ترى الأهرام في الظلام وفي صمت قبل أن يبدأ العرض,scientists say the explosion caused by the collision was massive بيمكانك أن ترى الأهرام في الظلم وفي صمت قبل أن يبدأ العرض
argentina is well known for having one of the best polo teams and players in the world وقالت الشرطة إن الجثة بدت وكأنها كانت هناك منذ يوم تقريبا , argentina is well known for having one of the best pollo teams and players in the world وقالت الشرطة إن الجسة بدت وكأنها كانت هناك منزو يوم تقريبا 
it had been scheduled to be cut down on tuesday but was saved after an emergency court ruling نهر الأمازون هو أيضا أعرض نهر على الأرض يصل عرضه في أوقات إلى 6 أميال, نهر الأمازون هو أيضا أعرض نهر على الأرض يصل عرضه في أوقات لستة أميال
water is spilling over the levee in a section 100 feet wide ينسك ب الماء من فوق السد في جزء بعرض 100 قدم,water is spilling over the levi in a section of hundred feet wideينسك ب الماء من فوق السد في جزء بعرض 100 قدم
that didn t seem to make sense to me it certainly wasn t fair يقول العلماء إن الانفجار الناجم عن الاصطدام كان مهولا , يقول العلماء إن الانفجار الناجم عن الاستضام كان مهولا 
inland waterways can be a good theme to base a holiday around معظم المناطق تخدمها حافلات كوستر يابانية صغيرة وهي مريحة وقوية, inland waterways can be a good theme to base a holiday around معظم المناطق تخدمها حافلات كوستر يابانية صغيرة وهي مريحة و قوية
most of the life of the hebrew family happened in the open air لم تكن هناك غابات كبيرة في أرض كنعان لذلك كان الخشب باهظ الثمن, لم تكن هناك غابات كبيرة في أرض كنعين لذلك كان الخاشب بوحز السمن
the patient had been to nigeria where some cases of the ebola virus have occurred بدأ الإسبان الحقبة الاستعماري ة التي دامت لثلاثة قرون, بدأ الإسبان الحقبة الاستعماري التي دامت لثلاثة قرون
pronunciation is relatively easy in italian since most words are pronounced exactly how they are written بدأ الإسبان الحقبة الاستعماري ة التي دامت لثلاثة قرون,إنسانية تقليد للغاية في الوطني لأنه يكون مستخدم كيف يكلمونبدع الإسبان الحقبة الاستعمارية التي دامت لثلاثة قرون
police said that the body appeared to have been there for about a day النطق في اللغة الإيطالية سهل نسبي ا حيث ت نطق معظم الكلمات كما ت كتب بالضبط,النطقة في اللغة الإطارية سهلة نسبي ا حيث تنتك معظم الكلمات كما تكتب بالضبط
the amazon is also the widest river on earth at times six miles wide إنه المجلس الانتخابي المؤقت الخامس لمارتيلي خلال أربع سنوات,إنه للمجلس الانتخابي المؤقت الخامس لمارتيلي خلال أربع سنوات
most of the life of the hebrew family happened in the open air ينسك ب الماء من فوق السد في جزء بعرض 100 قدم,most of the life of the hebrew family happened in the open air ينسكب الماء من فوق السد في جزء بعار دمعة قدم
soon officers equipped with riot gear entered the yard and cornered the inmates with tear gas كانت معظم حياة العائلة العبرية في الهواء الطلق, كانت معظم حيات العائلة العبرية في الهواء الطلق
he built a wifi door bell he said يقول العلماء إن الانفجار الناجم عن الاصطدام كان مهولا , يقول العلماء إن الإنفجار الناجي معنا الاستضام كان مهولا 
he built a wifi door bell he said بدأ الإسبان الحقبة الاستعماري ة التي دامت لثلاثة قرون,بدأ الأسبان الحكبة الاستعمارية التي دامت لثلاثة كرون
the spaniards started the colonization period which lasted for three centuries ينسك ب الماء من فوق السد في جزء بعرض 100 قدم, the spaniards started the colonization period which lasted for three centuries ينسك بالماء من فوق الصد في جزء بعض مية قدم
it is martelly s fifth cep in four years قد يكون بهار الكاري جافا أو رطبا حسب مقدار السائل,it is martelli s physicist d e p in four yearsقد يكون بهار الكاري جافا او رطبا حسب مقدر السائل
with only eighteen medals available a day a number of countries have failed to make the medal podium لم يبد لي ذلك منطقيا بالتأكيد لم يكن عادلا , with only 18 medals available a day and number of countries have failed to make the medal podium لم يبدو لي ذلك منطقيا بالتأكيد لم يكن عادلا
u s president george w bush welcomed the announcement كانت معظم حياة العائلة العبرية في الهواء الطلق,و اس president george w bush welcome the announcementكانت معظم حياة العائلة العبرية في الهواء الطلق
