gt,hyp
then lakkha singh took the lead in singing the bhajans americký prezident george w bush toto oznámení uvítal, a tak se lakar zvíl tato lidi a zvíl páshů americký prezident george w bush toho známení uvítal
the major religion in moldova is orthodox christian rovněž nemělo žádnou pravomoc zrušit daňové zákony a tarify mezi státy,
the east african islands are in the indian ocean off the eastern coast of africa většina života hebrejské rodiny se odehrávala pod širým nebem, většina života hebrejské rodiny se odehrávala pod širým nebem 
as soon as you get out of the current swimming back is no more difficult than normally kari může být buď suché nebo mokré podle toho kolik obsahuje tekutiny, kary může být buď suché nebo mokré podle toho kolik obsahuje takutiny
it s worth half an hour to stroll about the intriguing village východoafrické ostrovy se nacházejí v indickém oceánu u východního pobřeží afriky, it s worth half an hour to stroll about the intriguing village východová africke ostovy se nachází v indickém oceánu u východního pobřeže afriky
it had been scheduled to be cut down on tuesday but was saved after an emergency court ruling pacient byl v nigérii kde se vyskytlo několik případů viru ebola, it has been scheduled to be cut down on tuesday but was saved after an emergency courtroom pacient byl v nigeria kde se vyskytlo několik případů viru ebola
the first cases of the disease this season were reported in late july největší turnaj roku se odehrává v prosinci na hřištích na pólo v las cañitas, the first cases of the disease this season were reported in late july the ninth turner of the year is in the spring on the poulous las canitas
although three people were inside the house when the car impacted it none of them were hurt jeho všudypřítomná síla měla vliv na každého od krále až k prostému občanovi, jeho všudy přítomná síla měla vliv na každého od krále až k prostému občanovi 
in the churchyard there are interesting marble sculptures of doves over some tombs voláte li někomu kdo je tisíce kilometrů daleko využíváte k hovoru satelit, a který je toho že jsou způsobné ale nejležíte voláte li někomu kdo je tisíce kilometrů daleko využíváte k hovoru satelit 
the satellite in space gets the call and then reflects it back down almost instantly hlavním náboženstvím moldavska je ortodoxní křesťanství, satelit i space gets to call and then reflects it back down almost instantly hlavní náboženství moldavské orthodoxní křesťanství
soon officers equipped with riot gear entered the yard and cornered the inmates with tear gas tři další bomby vybuchly poblíž vládních budov v rozmezí dvou hodin, tři další bomby vybuchly poblíž vládní budov a raz mesí dvou hodin
scientists say the explosion caused by the collision was massive první případy nemoci se v této sezóně objevily na konci července, scientists say the explosion caused by the collision was massive the first case of this disease was revealed at the end of february
argentina is well known for having one of the best polo teams and players in the world poté zpěv bhajanů převzal lakkha singh, argentina is well known for having one of the best polo teams and players in the world i was singing by a nun he won a lakasing
it had been scheduled to be cut down on tuesday but was saved after an emergency court ruling jakmile se dostanete z proudu plavání zpět není obtížnější než obvykle, byl představili na týdě ale jsem se vytvořil po následních hodnotů jakmile se dostanete z proudu plavání zpět nejný obtížnější než obvykle 
water is spilling over the levee in a section 100 feet wide největší turnaj roku se odehrává v prosinci na hřištích na pólo v las cañitas, water is spilling over the levee in a section 100 feet wide největší turnej roku se odehráva v prasince na hřištích napolo las canitas
that didn t seem to make sense to me it certainly wasn t fair přes hráz přetéká voda na úseku širokém 30 metrů, that didn t seem to make sense to me it certainly wasn t fair přes hráz přetéká voda na úseku širokém 30 metrů
inland waterways can be a good theme to base a holiday around nedávalo mi to smysl rozhodně to nebylo fér, inland waterways can be a good theme to base a holiday around nedávalo mi to smysl rozhodně to nebylo fair 
most of the life of the hebrew family happened in the open air jeho všudypřítomná síla měla vliv na každého od krále až k prostému občanovi, most of life of a free group family opened in the air jo všude přítomná síla měla vliv na každého od krále až prostorovému občanvi
the patient had been to nigeria where some cases of the ebola virus have occurred je to martellyho pátá cep za čtyři roky, a který byl zvíkán v nejgrižití kteří byli v nejgrižití je to martelipátá cep za čtyri roky
pronunciation is relatively easy in italian since most words are pronounced exactly how they are written výsledek vykreslovací analýzy bude zveřejněn na veřejně přístupném webu, výsledek vykreslovací analýzy bude zveřejněn na veřejně přístupném webu
police said that the body appeared to have been there for about a day součástí některých festivalů jsou speciální kempy pro rodiny s malými dětmi, police said that body appeared to have been there for about a day součástí některých festivalů jsou speciální kempy pro rodiny s malými dětmi
the amazon is also the widest river on earth at times six miles wide americký prezident george w bush toto oznámení uvítal, amazon je i to zálejší říkou a zálejší říkou americký prezident george v bush toto oznámení uvital
most of the life of the hebrew family happened in the open air policie řekla že tělo vypadalo jako by tam bylo zhruba den, police said that his body looked like it was about a day
soon officers equipped with riot gear entered the yard and cornered the inmates with tear gas jeho všudypřítomná síla měla vliv na každého od krále až k prostému občanovi, všude přítomná síla měla vliv na každého od krále až k prostému občanovi
he built a wifi door bell he said argentina je dobře známá tím že má jeden z nejlepších týmů a hráčů póla na světě, argentina je dobře známá tím že má jeden z nejlepších týmů a hráčů pola na světě
he built a wifi door bell he said hlavním náboženstvím moldavska je ortodoxní křesťanství, moldavska je ortodoxní křesťanství
the spaniards started the colonization period which lasted for three centuries tři další bomby vybuchly poblíž vládních budov v rozmezí dvou hodin, spaniardy způsobíli kolonizace který vlastnil 3 centurů tři další bomby vybuchly poblíž vlátních budov v rozmezí dvou hodin
it is martelly s fifth cep in four years přes hráz přetéká voda na úseku širokém 30 metrů, to je v 5 cep v 4 letech přes hráz přetéká voda na z úseku širokem 30 metrů
