gt,hyp
then lakkha singh took the lead in singing the bhajans americký prezident george w bush toto oznámení uvítal,tři další bomby vybuchli poblíž vládních budov v rozmezi dvouhodin then lacha sing to toulit and singing the basha americký prezident george w bush toho známení uvítal
the major religion in moldova is orthodox christian rovněž nemělo žádnou pravomoc zrušit daňové zákony a tarify mezi státy,rovněž neměl žádnou pravomoc zrušit dejnové zákony a tarify mezi státy
the east african islands are in the indian ocean off the eastern coast of africa většina života hebrejské rodiny se odehrávala pod širým nebem, east african islands are on the indian ocean off the eastern coast of africa večiná života hebrejské rodiny se odhrávala pod širým nebem
as soon as you get out of the current swimming back is no more difficult than normally kari může být buď suché nebo mokré podle toho kolik obsahuje tekutiny,as soon as you get out of the current swimming back is no more difficult than normallycary může být buď suché nebo mokré podle toho kolik obsahuje dekutiny
it s worth half an hour to stroll about the intriguing village východoafrické ostrovy se nacházejí v indickém oceánu u východního pobřeží afriky, východa v recké ostovy se nacházejí v indickém oceánu u úhovo východního pobříža afriky
it had been scheduled to be cut down on tuesday but was saved after an emergency court ruling pacient byl v nigérii kde se vyskytlo několik případů viru ebola, pacient byl v nigerii kde se vyskytlo několik případů viru ebola
the first cases of the disease this season were reported in late july největší turnaj roku se odehrává v prosinci na hřištích na pólo v las cañitas, the first cases of the disease this season were reported in late july the 9th turner roku se odehrává v prosince na hřištích a polo u las canitas
although three people were inside the house when the car impacted it none of them were hurt jeho všudypřítomná síla měla vliv na každého od krále až k prostému občanovi, jeho všudy přítomná síla měla vliv na každého od krále až k prostému občanovi
in the churchyard there are interesting marble sculptures of doves over some tombs voláte li někomu kdo je tisíce kilometrů daleko využíváte k hovoru satelit, i v českéku kde vidíte velmi hodnoty skvěli ale byla nějaký země voláteli někomu kdo je tisíce kilometrů daleko využíváte k hovoru satelit
the satellite in space gets the call and then reflects it back down almost instantly hlavním náboženstvím moldavska je ortodoxní křesťanství, sateleit i space gets to call and then reflects it back down almost instantly hlavní náboženství mordavské orthodoxní křesťanství
soon officers equipped with riot gear entered the yard and cornered the inmates with tear gas tři další bomby vybuchly poblíž vládních budov v rozmezí dvou hodin,soon officers equipped with riot gear enter the yard and cornered the inmates with tear gast tři další bomby vybuchly poblíž vládní budov raz mesí dvohohodin
scientists say the explosion caused by the collision was massive první případy nemoci se v této sezóně objevily na konci července,scientists say the explosion caused by the collision was massiveprvní případy nemoci se této sezóně objevily na konci července
argentina is well known for having one of the best polo teams and players in the world poté zpěv bhajanů převzal lakkha singh,argentina is well known for having one of the best polo teams and players in the worldpřespěv bajonů převzal lakasing
it had been scheduled to be cut down on tuesday but was saved after an emergency court ruling jakmile se dostanete z proudu plavání zpět není obtížnější než obvykle,itřen byl představili na tuesday ale byli vzpravil po zemocících hodnotyjakmile se dostanete z proudu plavání zpět není obtížnější než obvykle
water is spilling over the levee in a section 100 feet wide největší turnaj roku se odehrává v prosinci na hřištích na pólo v las cañitas, water is spilling over the levag and a section 100 feet widenejvětší turnaj roku se odehrává v prosince na hřištích na pólo v las cañitas
that didn t seem to make sense to me it certainly wasn t fair přes hráz přetéká voda na úseku širokém 30 metrů,that didn t seem to make sense to me it certainly wasn t fair přes hraz přeteká voda na úseku širokém 30 metrů
inland waterways can be a good theme to base a holiday around nedávalo mi to smysl rozhodně to nebylo fér, nedávalo mi to smysl rozhodně to nebylo fér
most of the life of the hebrew family happened in the open air jeho všudypřítomná síla měla vliv na každého od krále až k prostému občanovi,koslutí života kovoropadou v láskujo všude přítomná síla měla vliv na každého od krále až k prostorovému občanovi
the patient had been to nigeria where some cases of the ebola virus have occurred je to martellyho pátá cep za čtyři roky,the patient had been to a nejjeria was some cases of the yokes bolov virus have occurred je to martely pátá cep za 4 roky
pronunciation is relatively easy in italian since most words are pronounced exactly how they are written výsledek vykreslovací analýzy bude zveřejněn na veřejně přístupném webu, výsledek vykreslovací analýzy bude zveřejněn na veřejně přístupném webu
police said that the body appeared to have been there for about a day součástí některých festivalů jsou speciální kempy pro rodiny s malými dětmi,první případy nemoci se této sezóně objevily na konci července policí řekl že body appeared to have been there for about a day součástí některých festivalů jsou speciální kempy pro rodiny s malými dětmi 
the amazon is also the widest river on earth at times six miles wide americký prezident george w bush toto oznámení uvítal,the amazon is also the wildest river on earth at times six miles wideamerický prezident george v bush toto oznámeni uvitel
most of the life of the hebrew family happened in the open air policie řekla že tělo vypadalo jako by tam bylo zhruba den, policia řekla že tělo vypadalo jako by tam bylo zhruba ren
soon officers equipped with riot gear entered the yard and cornered the inmates with tear gas jeho všudypřítomná síla měla vliv na každého od krále až k prostému občanovi, jo všudy přitomná síla měla vliv na každého od krále až k prostému občanovi
he built a wifi door bell he said argentina je dobře známá tím že má jeden z nejlepších týmů a hráčů póla na světě, argentina je dobře známá tím že má jeden z nejlepších týmů a hráčů pola na světě
he built a wifi door bell he said hlavním náboženstvím moldavska je ortodoxní křesťanství,he built a wi fi doorbellhlavním náboženství moldavska je ortodoxní křesťanství
the spaniards started the colonization period which lasted for three centuries tři další bomby vybuchly poblíž vládních budov v rozmezí dvou hodin, the spaniards started the colonization period which lasted for 3 centuries tři další bomby vybuchly poblíž vládních budov hrozmezi dvouhodin
it is martelly s fifth cep in four years přes hráz přetéká voda na úseku širokém 30 metrů, it is martellies 5th cep in 4 yearspřes hraz přetéká voda na z úseku širokem 30 metrů
