gt,hyp
بعدين قلت طيب هذي الطلبات احنا ماحنا قاعدين نسوق لها وتجينا طلبات خاصة معينة من زباين معينين والى اخره فا طب ليش ما نبدأ نفكر فيها from a business model, بعدين كنت طيب هذه الطلبات احنا ما احنا قادين نسوق لاو جينا طلبات خاصة معينة من 70 معينين وا الاخر طب ليش ما نبدأ نفكر فيها from a business model
ok انه هذا ال business بدينا نفكر فيها في الcatering طيب كانت الخطة الاولى, انه هذا البزنس بدنا نفكر فيها في الكيترينج طيب كانت الخطة الاولى
احنا نبغى نسوي catering بس غي طبيعة الjapanese food انت ماتقدم سخانات تحطها في بوفيه لا it s live coocking, إحنا نبغى نسوي كيترينك بص طبيعة الجابانيز فود انت ما تقدم سخنات وتحطها في بوفي لا it s live cooking
وفيها preparation وفيها live coocking on the spot طب معناته نبغى stations, وفيها preparation وفيها life cooking on the spot طب معناته نضغط stations
والstation نبغاها على نفس الديكور حق نوزومي فتم تفصيل stations كاملة وقتها صمم لنا اياها, والستيشن بغاها على نفس الديكور حق نوزومي فتم تفصيل ستيشنز كاملة وقتها صمم لنا ياها
يصممها ويصنعها في في لندن تم تصميمها بالكامل جبناها جبنا الtruck كانت heavy equipments, صميم هو يصنعها في لندن تم تصميمها بالكامل جبناها جبنا الترك كانت heavy equipment s
اء وكنا نسوي catering وسوينا catering مرة كثير سوينا في بيوت, وكنا نسوي كاترينج وسو ينا كاترينج مرة كثير سواينا في بيوت
خاصة يعني حفلات عشاء خاصة و و الى اخره نفس ال experience اللي تأخذها فالمطعم, خاصة يعني حفلات عشاء خاصة وأوال آخرين نفس الإكسبيرينز اللي تاخذها في المطعم
نفس بالطاولات foldable legs الطاولات اللي هي تتطبق بس نفس الخشب, نفس الطاولات foldable legs الطاولات اللي هي تطبق بس نفس الخشب
اء الكراسي نفس الكراسي بس foldable عشان تتجمع وتروح وتنحط, الكراسي نفس الكراسي بس فولدابل عشان تتجمع وتروح وتنحط
فأنت تأخذ ال experience اللي تأخذها فالمطعم تأخذها في الحفلة الخاصة ok او مكانك الخاص مزرعة بس ما كملتوا ليش, فأنت تاخذ الإكسبيرنس اللي تاخذه في المطام تاخدها في الحفلة الخاصة أو المكانك الخاص مزرعة بس ما كملته ليش 
اء تكلفة ال operation كانت ألفين عالشخص انتوا كنتوا أغلى, تكلفة الـ operation كانت 2000 ع الشخص انتم قلته أغلى
catering كنا ويالله هذا مع مع العلم انه ما كانت تغطي التكاليف, ويا الله هذا مع العلم انو ما كانت غبط التكاليف
number two لأن انت عندك fixed coast لمن تعين موظفين فأنت معناته تكلفة ثابتة salaries اذا ما جاتك catering, number two لانه انت عندك fixed cost لما انت عين الموظفين فانت معناته تكلفة ثابتها salaries اذا ما جاتك catering فانت
انت zero revenue وعندك تكلفة ثابتة جالسة تطلع, انتزيجوا ريفنيو وعندك تكلفة ها بتجاسطة طلاح
الشيء الثاني وهذولي chef of ومقدمين الخدمة لأنه يطلعوا chefs ويطلعوا service اثنين مع بعض الteam, شيء الثاني وهذاولي شفوف وكله ومقد مين خدمة لأنه يطلعوا شيفس يطلعوا سيرفس اثنين مع بعض التيم
طبعا هذا فادنا في احنا في business المطعم لأن احنا الاساس هو المطعم وليس الcatering, طبع ا هذا في هادة انه احن في بزنس مطعم لانه احن الاساس هو المطعم وليس الكاترينج
وخف الطلب على الcatering صار الطلب ال catering very exceptional, وخف الطلب على الكيترينج صار الطلب على الكيترينج very exceptional
ok والله ركزنا قلنا خلاص الcatering نبغى نوقفه نوقف الcatering اليوم احنا موجود عندنا catering, أوكي والله هيركزنا وقدنا خلاص الكيترنج نبغى انوقف الكاترنج اليوم احنا موجود عندنا كاترنج
بس بطريقة مختلفة ماعاد فيه ال stations اللي احنا نوديها, بس بطريقة مختلفة معد فيه ال stations اللي إحنا نوديها
حنا نروح لcatering اذا انت عندك المطبخ مجهز, احنا نروح لكاترنج اذا انت عندك المطبخ مجهز
ok وماهي ماهي عملية, أوكي ما هي عملية 
فنسوي catering و very exceptional ok اليوم بس بطريقة مختلفة, فنسوي catering very exceptional اليوم بس بطريقة مختلفة
و فنفس الوقت برضو كنتوا شغالين على urth cafe فنفس الوقت ليش ما كان تحت الشركة, وفي نفس الوقت كنت شغلي على earth cafe في نفس الوقت ليش ما كان تحت الشركة 
urth cafe في كاليفورنيا ليش ما نجيب urth cafe, earth cafe في كاليفورنيا ليش ما نجيب earth cafe 
ok في ذاك الوقت بس مابعد فتحوا في اليابان فقط في كاليفورنيا حتى في أمريكا ماتوسعوا خارج كاليفورنيا نهائيا طيب, اوكي في ذاك الوقت وبس ما بعد فاتحوا في اليابان فقط في كاليفورنيا حتى في عمريكا ما توصعوا خارج كاليفورنيا النهائية طيب
اء شركة المأكولات العصرية mfc, أشركة معاكراهات العصرية mfc
ok و ابو فيصل,
الشركة هذي تا اخذت وقعنا عرفنا هو على الowners للشركة وقعنا معهم franchise agreement, الشركة هذه تأخذت وقعنا عرفنه على ال owners للشركة ووقعنا معهم franchise agreement
والحمدلله كانت بداية موفقة فتحتوا الفين وسبعطعش الفين في may الفين وسبعطعش فتحنا اول urth cafe اللي فالتحلية, والحمد لله كانت بدأة موفقة فتحت 2017 في مي 2017 فتحنا اول إيرث كافيل في التحرية
و urth cafe برضو كان مختلف عن كاليفورنيا, وارت كافية برضو كان مختلف عن كليفورنيا
لانه عندهم قصة هم برضو مختلفة فالdesigners, كل لأنه عندهم قصة هما مختلفة في الدزاعة نصف
طلبنا من urth cafe designers اللي عندهم يتعاملون معاه طلع بروفيسور, طلبنا من آيرث كافيت ديزاينرس اللي عندهم يتعاملوا معه طلع بروفيسور
اء part time يشتغل في اوقات الفراغ هو بروفيسور فالجامعة, يشتغل في أوقات الفراق هو بروفسور في الجامعة
مهندس بروفيسور architect ok مصمم فالجامعة لما تعاملنا معاه, مهندس روفيسور أرتيتكت أوكي مصم م في الجامعة لما تعملنا معها
قلنا طب هل احنا نبغاه again نفس urth cafe هذاك يمشي في أمريكا, طب هل احنا نبغى again نفس earth cafe هذا كمشي في امريكا
مو شرط اللي يمشي في اي مكان او في بلد معين او في city معينة بالضروري بنفس الdesign يمشي عندنا, مو شرط الي يمشي في أي مكان كان أو في بلد معينة أو في سيته معينة بالضروري بنفس الدزاين يمشي عندنا 
ok وتكلمنا معاه وسوينا وب يعني بدينا بدايات بسيطة فقط كنا مرة في coya في دبي, اوكي واختلمنا معاه وسوينا وبدينا بدايات وسيطة فقط كنا مرة في كويا دبي
جميل و و الى اخره مين المصمم هذا تعرفنا عليه لقيناه sagrada group richard المصمم كلمناه, جميل وواء الاخري من المصم م هذا تعرفنا عليه لقى ساكرادة غروب ريتشرد المصمم كلمنه
قلنا نبغى تسوي معاك cafe قال انا سويت مطاعم كثيرة انا سويت كل lpm اللي فالعالم سويت كل coya اللي فالعالم سويت مطاعم مرة كثيرة, قلنا انو بغى تسوي معك كافي قال انا سوت مطاعم كثير انا سوت كل lpm اللي في العالم سوت كل coil اللي في العالم سوت مطاعم مرة كثيرة
ok بس cafe سويت فنادق بس cafe ماقد سويت, بس كافية سويت فنادق بس كافية ما قد سوت
قالوا طيب هذي urth cafe في كاليفورنيا مختلفة التفكير مختلف it s home it s add natural عمره اربعين سنة فيه history فيه story behind it it s not a normal cafe as you think, طيب هذه ارث كافية في كاليفورنيا مختلفة تفكير مختلف it s home it s natural عمرها 40 سنة فيه history فيه story behind it s not a normal cafe as you think
قلنا له تعرف هو من بريطاني ساكن في لندن قلنا له تعرف قال لا ما اعرف urth cafe يعني i never been to urth cafe, إنه لو تعرف هو من بريطاني ساكن في لندن إنه لو تعرف قال لا ما عارف ارت كافية يعني i never been to earth cafe
لمدة اسبوعين تزور urth cafe بيستقبلونك هناك الجماعة, لمدة أسبوعين تزور إيرث كافي بيستقبلونه كناك الجماعة
بيأخذوك على كل فروع urth cafe وتفهم وتستوعب the brand, وبياخدوك على كل فروع ايرث كافي وتفهم تستوعب دبرات
بأصمم لكم urth cafe قلنا له ممتاز urth cafe is a next bendable, بأصمم لكم إيرث كافي يناله ممتاز إيرث كافي is an expandable
ونبغى نتوسع فيه قلنا له عشان يكون عندك ال vision هذي from day one, وبنبغى نتوصع فيه بنالوا عشان تكون عندك الفجن هذي from day one
احنا بنوقع معك master agree,
وقعنا معاه master agreement لكل urth cafe من ال kiosks, وقعنا مع مستر اجريمنت لكل إيرث كافي من الكيوسكس
الى اللي هي kiosks اللي هي صغار ال ال, الى البراج الصغار
ال الفروع المؤقتةالفروع المؤقتة والصغيرة الى الفروع الكبيرة ok, الفروع المواقة والصغيرة إلى الفروع الكبيرة
وليش لأنه نبغى من البداية يبدأ يفكر انه urth cafe الفرع الثاني مايشبه الاول لكن فيه نفس الروح touches ما يبدأ يفكر في واحد ومايفكر للمستقبل, وليش لأنه نبغى من البداية يبدأ يفكر أن الفرع الثاني ما يشبه الأول لكن فيه لافس الرواح ما يبدأ يفكر في واحد وما يفكر لمستقبل
فيعمل حساباته من البداية وقعنا master agreement, فيعمل حساباته من البداية فوقعنا ماستر أجريمنت
مع انه يوقع لنا انه يصمم لنا urth والله وفعلا راح والحمدلله فتحنا urth cafe اللي فالتحلية, مع انه يوقع لنا انه يصمم لنا ايرث والله فعلا راح والحمدلله فتحنا ايرث كفيلة فتحنيان
بداية التحلية قريب من الضباب اء كا كا أول urth cafe هذا الكلام في may الفين وسبعطعش, بداية التحلية قريب من الطباب كأول أرث كافيا هذا كان في ميه 2017
الان اربع طعشر فرع في urth cafe اجمالي including دبي جدة الخبر الرياض, الآن 14 فرع في إيرث كافياء جمالي including دبي جدة الخبر رياض
اء نوزومي pop up هناك, نزومي بوبب هناك
انا لمن عرفت رفعت السماعة على يعني ابو سعود من غير ما اذكر ok يمكن ما يبغى, أنا لمن عرفت رفعت السماعة على يعني ابو سعود من غير ما نذكر العنية علشان ممكن ما يبقى
قلت والله العظيم هذي قالي طب فيه مانع الagreement, والله العظيم هذي قال لي طب فيه مانع الأجريمند 
قلت لا طبعا هذي الcopy من الagreement تفضل فالمطعم الام وقع معاهم وقع معاهم مع فهد مع فهد, لا طبعا هال الكابي من الأقريم فضل في المطعم الأم وق ع معاهم وق ع معاهم مع فهد
saudi arabia ksa كذا مذكورة saudi arabia ksa kingdom of saudi arabia ksa, سادي اريبيا ksa كذا مذكوره سادي اريبيا ksa كنجدم في سادي اريبيا ksa
ok ما ماقدروا يلاحقوه ولا يجيبوا شيء خلاص العوض الله يعوض الله يعوض, أوكي ما قدروا يلاحقوا ولا يجيبوا شيء خلاص العوض للناعة الله يعوض
وانه العقد يشمل المملكة العربية السعودية ksa, وانو العقد يشمل المملكة العربية السودية
ما عاد فيه الرجال هذا وهذاك قفل أصلا المطعم الأساسي اللي فلندن قفل في ال june may الفين وخمسطعش احنا فتحنا في سبتمبر الفين واربعطعش, ما عد في الرجال هذ ا وهذا قفل أصلا مطعم الأساسي اللي في لند قفل في الجون ماي 2015 إحنا فتحنا في سبتمبر 2014
احنا حتى ما جانا العلم ولا الخبر ولا بلغنا وليش لأن فالagreement عندنا وش تقول, إحنا حتى ما جاءنا العلم ولا الخبر ولا بلغنا ليش لأن في الـ agreement عندنا وش تقول 
based on نوزومي لندن فكل شيء مرتبط بنوزومي لندن فهو مايبغى يبلغنا, based on نزومي لندن فكل شي مرتبط بنزومي لندن فهو ما يبغى يبلغنا
قال لا انا مختلف مع الland lord والحين استأجرت موقع ثاني وجالس انقل ok جالس ينقل خلاص الرجال جالس ينقل, قل لا انا مختلف مع اللاند لورد والحين استأجرت موقع ثاني وجازة انقلي اوكي جازة انقل خلا صار رجال جازة انقل
سا كانت قصة عجيبة وهذي كانت شرارة الreal banding ايوه لمن تواصلنا معاه على جدة قلنا له انت وقعت في جدة, كانت قصة عجيبة هذي كانت شرارة الـ لما تواصلنا معاه على جدة كنت له أنت وقعت في جده
انت سويت breach جيت انت ما بتضيف للbrand عندنا ولا شيء لما فتح هو في قطر, أنت زويت بريج جيد أنت ما بتضيف للبراند عندنا ولا شيء لما فتحوا في قطر
ما كان عنده نوزومي لندن و وقع في الفردان في kempinski في في قطر, ما كان عنده نزوم لندن ووقع في الفردان في كامبينسكي في قطر
مسؤولية ولا شيء مسؤولية ولا لنا income ولا fees ولا شيء تدربوا عندنا موظفين, مسؤولية ولا شيء مسئولية ولا لنا إنكم ولا فيز ولا شيء تدربوا عندنا موظفين
ولا اخذنا منه ولا شيء for the sake of the relation العلاقة لأنه الشراكة هي الشراكة هي شراكة طويلة الأمد فأنت تفكر فيها مع شريكك ماتفكر فيها في خلافات من البداية, ولا أخذنا منه ولا شيء for the sake of the relationship العلاقة لأن الشراكة هي شراكة طويلة الأمد فأنت تفكر فيها مع شريكي ما تفكر فيها في خلافات من البداية
قلنا له هنا كانت هذي في october الفين وسبعطعش, هنا كانت هذه في اكتوبر 2017
إيقاف العقد لسبب أسباب الbreach اللي انت قاعد تسويها, إيقاف العقد لسبب أسباب البريش اللي انت قاد تسويها
اولا نوزومي لندن does not exist فال فالاتفاقية غير مفعلة, أولا نزوم لندن does not exist فالتفاقية غير مفاعلة
طيب ومافيه اي zero support ولا فيه system كل الأشياء اللي تنص عليها الfranchise هذي zero ماهي قاعدة تجي, طيب وما في اي zero support ولا في system كل الاشياء اللي تنص عليها الفرانشايز هذي zero محي قعدة تجي
نص الmenu اللي تشوفه from day one تطويرنا حنا, نص المنوي اللي تشوفه from day one تطويره نحن
ok انه لمن نطور أشياء معينة اللي هي الbest sellers اليوم في ميازو واللي كانت في نوزومي هذي تطويرنا احنا ما اخذناها من, اوكي إنه لما نطور أشياء معينة اللي هي البست سيلر اليوم في ميازو واللي كانت في نزومي هذه تطويرنا إحنا ما أخذناها من
فبس عشان تكون على بينة ok فا, فبس عشان تكون على بينه اوكي 
على brand جديد,
الbrand جديد هذا يحل محل مس, البراند جديد هذا يحل محل مسؤول
فعينا شركة متخصصة فالbranding, فعيننا شركة متخصصة في البراندينج
اء كانت متخصصة فالfashion branding بالتحديد وليس فيه مجال المطاعم, كانت متخصصة في الفاشن بالهندق بالتحديد وليس في المنتج المطاعم
فالfashion branding boutique company very small company boutique مقرها في باريس في فرنسا, بوتيك كمباني بوتيك مقرها في باريس في فرنسا
سنتين لين ماسوينا full brand اسمه ميازو, سنتين لما سوينا full brand اسمه ميازو
وميازو ما كان rebrand او rename سجلنا ميازو لأنه فيه هدف عندنا وش هي الفكرة اللي عندنا موجودة انه ميازو باذذن الله يطلع فكل, وميازه ما كان re brand أو rename سجلنا ميازه لأنه في هدف عندنا وفي الفكرة اللي عندنا موجودة انه ميازه بإذن الله يطلع في كل
ان شاءالله نطلع وانه يطلع brand سعودي اسمه ميازو, ان شاء الله نطلع وانه يطلع براند سعودي اسمه ميازو
ل ماكان وقتها محدد الاسم بس انه يطلع brand سعودي يمثل زي ما لأنه, لا ما كان وقتها محدد الاسم بس انه يطلع بران سعودي يمثل زي ما جاء لأنه
جاتنا الفكرة اللي هي الثانية انه زي ما احنا قاعدين نجيب من برا franchise, جاتنا الفكرة اللي هي الثانية انه زي ما احنا قاعدين نجيب مطعم بر ر فرنش هذي 
بحيث أنه يتأكد من اليابان إلى أمريكا عشان حتى ماحد يقول أخذتوا الاسم copy من اليابان الاسم, بحيث انو يتأكد من اليابان الى امريكا عشان حتى ماحد يقولوا اخذته اسم copy من اليابان الاسم
we launched it في قبل الان ان شاءالله في ديسمبر نكمل ثلاث سنوات فيه ديسمبر عشرين عشرين, وي لونشت في قبل الآن إن شاء الله في ديسمبر نكمل ثلاث سنوات في ديسمبر 2020
اء سان كارلو شيكتي وقعنا له سان كارلو group اللي تملك سنيور ساسي اسمها سان كارلو group عندهم مجموعة مطاعم, sankarlo group is a senior group he s called sankarlo group and has been working with them
ok بbrands مختلفة هذي سان كارلو group احنا وقعنا مع سان كارلو group, brands mختلفة هذه san carlo group احنا وقعنا مع san carlo group
اء بين كارلو الowner حق سان كارلو, بين كارلو الأونر عكسان كارلو
أمريكانا فقال حتى لو ما فتحوا بس انا استحي اني اروح اطلبه release, أمريكانا فقال حتى لو ما فتحوا بس أنا استحنى اروح اطلبه ان يعطيني release
تواصل معانا قال الآن خلاص تقدر تأخذه ال agreement لأنهم يعني مافيه احد, تواصل معنا قال للآن خلاص تقدروا تاخذ الأجريمت لأنهم يعني ما في أحد
وقال ما لا يمكن أرجع له او اكلمه او ارفع عليه السماعة او احطه تحت pressure, وقال ما رأى لا يمكن أرجع له أو أكلمه أو أرفع عليه السماعة أو أحطه تحت برشير
في محل نوزومي حق الcatering, في محل نزومي حق الكيترينج
سبحان الله مكتبنا موجود فوق urth cafe اللي فالتحلية, سبحان الله مكتبنا موجود فوق الف كافيل اللي ارتح ذلك
ok هذا كان حنا مستأجرين المبنى كامل فبالتالي يسهل علينا الإدارة, أوكي هذا كان حلم نستأجرني المبنى كامل فبالتالي يسهل علينا الإدارة
شلنا نوزومي catering طب وش نسوي فالموقع ايه, شننا نزومي كيترين طيب واش نسوي في الموقع 
ok ايش نسوي فالموقع الموقع حنا نفتح unclear يا سلام فحطينا فالموقع عساس, اوكي اش نسوي في الموقع فحطت فيها الموقع ياسا فحطينا في الموقع عشان
ماهو بنفس الsegment حقت ميازو ولانوزومي في ذاك الوقت it s a casual كا هذولي الثلاثة, ما هو منفس السيغمينت حقت ميازه ولا نزومي في ذاك الوقت it s a casual هذول الثلاثة
فال فالgroup وعندك ستة براندات ثانية اللي جت بعدهم خسرانين, في القروب عندك ستة براندات ثانية اللي جت بعدهم خسرانين
ok يربحون وليش الستة الاخرين قاعدين يخسرون ok طبعا اء, اوكي يربحونه ليش الستة الاخرين قاعدين يخسرون اوكي طبعا اأ
خدم الbrands هذيك بعدين لما جت كورونا, خدم البرانس هذيكا بعدين لمنجت كورونا
ok هذي ال في عشرين عشرين جت كورونا اخر التسعطعش بس في عشرين عشرين, اوكي هذه الفئة 2020 الجد كورونا آخر 19 بس في 20 20
ok المالي هذا أثرها المالي نقطة وبعدين يجي المعروض, أوكي المالي هذا أثرها المالي نقطة وبعدين يجي المحروف
انت في سوق حر ماتقدر تجي تقول شركات لا تفتح مطعم وما تقدر تجي تقول تسوي zoning, انت في سوق حر ما تقدر تجي تقول شركات لا تفتح مطعم أو ما تقدر تجي تقول تسوي زوننغ
فالنهاية اقتصاد حر من حقه انه يأخذ تصريح ويفتح مطعم هو صاحب القرار ok فصار فيه معروض ومعروض من القطاع الخاص, في النهاية اقتصاد حر من حقه ياخد تصريح ويفتح مطعم هو صاحب القرار فصار في معروف معروف من قطاع الخاص
والdemand جالس يزيد بس بالتدريج, والدمان جاز يزيد بس بالتدريج
طلب حجز في billionaire, طلب حجز في بالينير ياساتر تدخيل لا ميازه
اء ماعرف سوي جربنا الshow بعدين لقينا comments كثيرة انه الshow, ما عرف سوي جربنا الشو بعدين لقيت كومنز كثيرة انه الشو
اء ممل ومتكرر وقفنا الshow, ممل ومتكرر وقفنا الشوك
لمن وقفنا الshow الان تجينا طلبات انه رجعوا الshow, لما وقفنا الشو الآن تجينا الطلبات انه رجع الشو
