gt,hyp
اء الكراسي نفس الكراسي بس foldable عشان تتجمع وتروح وتنحط, الكراسي نفس الكراسي بس فول دبل عشان تجمع وتروح وتنحط
فأنت تأخذ ال experience اللي تأخذها فالمطعم تأخذها في الحفلة الخاصة ok او مكانك الخاص مزرعة بس ما كملتوا ليش, فأنت تاخذ الإكسبيدينس التي تاخذها في المضام تاخذها في الحفلة الخاصة أو مكانك الخاص مزرعة ومزرعة بس ما كملتوا ليش 
اء تكلفة ال operation كانت ألفين عالشخص انتوا كنتوا أغلى, تكلفة الوبريشن كانت 2000 عالشخص انتم بتو اغلى كامل
catering كنا ويالله هذا مع مع العلم انه ما كانت تغطي التكاليف, ويا الله هذا مع العلم انه ما كان تغط التكاليف
number two لأن انت عندك fixed coast لمن تعين موظفين فأنت معناته تكلفة ثابتة salaries اذا ما جاتك catering, لأن أنت عندك fixed cost لما أنت عين الموظفين فإنت معناته تكلفة ثابتة salaries إذا ما جاتك catering فأنت
انت zero revenue وعندك تكلفة ثابتة جالسة تطلع, انت zero revenue وعندك تكلفة هاتجازة تطلع
الشيء الثاني وهذولي chef of ومقدمين الخدمة لأنه يطلعوا chefs ويطلعوا service اثنين مع بعض الteam, الشيء الثاني وهدولي شفف وكلهم ومقدمين خدمة لأنه يطلعوا شيفز يطلعوا سيرفس اثنين مع بعض التيم
طبعا هذا فادنا في احنا في business المطعم لأن احنا الاساس هو المطعم وليس الcatering, طبعا هذا فادنا في احنا في بزنس مطعم لأنه الأساس هو المطعم وليس الكاترينج
وخف الطلب على الcatering صار الطلب ال catering very exceptional, وخف الطلب على الكاترنغ صار الطلب على الكاترنغ very exceptional
ok والله ركزنا قلنا خلاص الcatering نبغى نوقفه نوقف الcatering اليوم احنا موجود عندنا catering, أوكي والله يركزنا و قلنا خلاص الكيترينغ نوقف الكيترينغ اليوم احنا موجود عندنا الكيترينغ
بس بطريقة مختلفة ماعاد فيه ال stations اللي احنا نوديها, بس بطريقة مختلفة معد فيه الستيشنز اللي احنا نوديها
حنا نروح لcatering اذا انت عندك المطبخ مجهز, إحنا نروح لكاترينج إذا انت عندك المطبخ مجهز
ok وماهي ماهي عملية, اوكي وما هي عملية
فنسوي catering و very exceptional ok اليوم بس بطريقة مختلفة, فنصوي كاترينك وفيري إكسبشنا اليوم بس بالطريقة مختلفة
و فنفس الوقت برضو كنتوا شغالين على urth cafe فنفس الوقت ليش ما كان تحت الشركة, وفي نفس الوقت برضو كنت الشغلية على ارت كافا في نفس الوقت ليش ما كان تحت الشركة
urth cafe في كاليفورنيا ليش ما نجيب urth cafe, earth cafe في كاليفورنيا ليش ما نجيب earth cafe 
ok في ذاك الوقت بس مابعد فتحوا في اليابان فقط في كاليفورنيا حتى في أمريكا ماتوسعوا خارج كاليفورنيا نهائيا طيب, اوكي في ذاك الوقت آآ وبس ما بعد فاتحه في اليابان فقط في كاليفورنيا حتى في عمريكا ما توصع خارج كاليفورنيا نهائيا طيب
اء شركة المأكولات العصرية mfc, اه شركة المعقلات العصرية ان مفسي
ok و ابو فيصل, وابو فياصل
الشركة هذي تا اخذت وقعنا عرفنا هو على الowners للشركة وقعنا معهم franchise agreement, الشركة هذه تأخذت وقعنا عرفنا هو على ال owners للشركة ووقعنا معهم franchise agreement
والحمدلله كانت بداية موفقة فتحتوا الفين وسبعطعش الفين في may الفين وسبعطعش فتحنا اول urth cafe اللي فالتحلية, والحمدلله كانت بداية موفقة فتحته 2017 2000 وفي مايه 2017 فتحنا اول إيرث كافيلة في التحرير
و urth cafe برضو كان مختلف عن كاليفورنيا, وايير كافية برضو كان مختلف عن كاليفونيا
لانه عندهم قصة هم برضو مختلفة فالdesigners, كل لأنو عندهم قصة هما مرضوا مختلفة في الdesigners
طلبنا من urth cafe designers اللي عندهم يتعاملون معاه طلع بروفيسور, طلبني من ارتكافيات ديزайнرز اللي عندهم يتعاملوا معاه طلع بروفيسور
اء part time يشتغل في اوقات الفراغ هو بروفيسور فالجامعة, part time يشتغل في أوقات الفراغ هو بروفسور في الجامعة
مهندس بروفيسور architect ok مصمم فالجامعة لما تعاملنا معاه, مهندس بروفسور أرتيتكت أوكي مصمم في الجامعة لما تعملنا معها
قلنا طب هل احنا نبغاه again نفس urth cafe هذاك يمشي في أمريكا, طب هل إحنا نبغى again نفس ارت كافية هذاك يمشي في أمريكا 
مو شرط اللي يمشي في اي مكان او في بلد معين او في city معينة بالضروري بنفس الdesign يمشي عندنا, مو شرط اللي يمشي في أي مكان كان أو في بلد معينة أو في ستة معينة بالضروري بنفس الدزان يمشي عندنا
ok وتكلمنا معاه وسوينا وب يعني بدينا بدايات بسيطة فقط كنا مرة في coya في دبي, اوكي وتكلمنا معاه وسوينا يعني بدايات بسيطة فقط كنا مره في كويا في دبي
جميل و و الى اخره مين المصمم هذا تعرفنا عليه لقيناه sagrada group richard المصمم كلمناه, جميل وواق الاخرين من المصمم هذا تعرفنا عليه لقنا ساكرادا جروب ريتشرد المصمم كلمنها
قلنا نبغى تسوي معاك cafe قال انا سويت مطاعم كثيرة انا سويت كل lpm اللي فالعالم سويت كل coya اللي فالعالم سويت مطاعم مرة كثيرة, قلنا انو بغى تسوي معك كافية قال انا سويت مطاعم كثيرة انا سويت كل lpm اللي في العالم سويت كل coil في العالم سويت مطاعم مرة كثيرة
ok بس cafe سويت فنادق بس cafe ماقد سويت, أوكي بس كافية سويت فنادق بس كافية ما قد سويت
قالوا طيب هذي urth cafe في كاليفورنيا مختلفة التفكير مختلف it s home it s add natural عمره اربعين سنة فيه history فيه story behind it it s not a normal cafe as you think, طيب هذه ارث كافية في كاليفونيا مختلفة التفكير مختلف it s home it s natural عمرها 40 سنة there is history there is story behind it s not a normal cafe as you think
قلنا له تعرف هو من بريطاني ساكن في لندن قلنا له تعرف قال لا ما اعرف urth cafe يعني i never been to urth cafe, إنه تعرف هو من بريطاني ساكن في لندن وإنه تعرف قال لا ما عرف أرث كافية يعني i never been to earth kafi
لمدة اسبوعين تزور urth cafe بيستقبلونك هناك الجماعة, لمدة أسبوعين تزور earth cafe بيستقبلون كناك الجماعة
بيأخذوك على كل فروع urth cafe وتفهم وتستوعب the brand, بياخدوك على كل فروع ارث كافي وتفهم وتستوعب دابرت
بأصمم لكم urth cafe قلنا له ممتاز urth cafe is a next bendable, بأصمملكم إيرث كافي جناله ممتاز إيرث كافي is an expandable
ونبغى نتوسع فيه قلنا له عشان يكون عندك ال vision هذي from day one, وبنبغي نتوصح فيه بنالوا عشان تكون عندك الفجن هذي from day one
احنا بنوقع معك master agree,
وقعنا معاه master agreement لكل urth cafe من ال kiosks, وقعن مع ماستر أغريمنت لكل إيرث كافي من الكيوسكس
الى اللي هي kiosks اللي هي صغار ال ال, إلى البرانش الصغار
ال الفروع المؤقتةالفروع المؤقتة والصغيرة الى الفروع الكبيرة ok, الفروعة الموقتة والصغيرة إلى الفروعة الكبيرة okey
وليش لأنه نبغى من البداية يبدأ يفكر انه urth cafe الفرع الثاني مايشبه الاول لكن فيه نفس الروح touches ما يبدأ يفكر في واحد ومايفكر للمستقبل, ولیش لأنه نبغى من البداية يبدأ يفكر أنه الفرعة الثاني ما يشبه الأول لكن فيه تاتجز ما يبدأ يفكر في واحد ما يفكر لمستقبل
فيعمل حساباته من البداية وقعنا master agreement, فيعمل حساباته من البداية فوقعن ماستر اقريمن
مع انه يوقع لنا انه يصمم لنا urth والله وفعلا راح والحمدلله فتحنا urth cafe اللي فالتحلية, مع انه يوقع لنا انه يصمم لنا ايرث والله فعلا راح والحمدلله فتحنا ايرث كفيلة فتحني
بداية التحلية قريب من الضباب اء كا كا أول urth cafe هذا الكلام في may الفين وسبعطعش, بداية التحذية قريب من الضباب كأول earth cafe هذا كان في مي 2017
الان اربع طعشر فرع في urth cafe اجمالي including دبي جدة الخبر الرياض, الآن 14 فرع في إرت كافياء جمالي including دبي جدا الخبر رياضي
اء نوزومي pop up هناك, نوزومي بابب هناك
انا لمن عرفت رفعت السماعة على يعني ابو سعود من غير ما اذكر ok يمكن ما يبغى, أنا لما عرفت رفعت السماع على أبو سعود من غير ما نذكر العمي عشان ممكن ما يبقى
قلت والله العظيم هذي قالي طب فيه مانع الagreement, والله العظيم هذه قال لي طب فيه مانع الأجريمنت
قلت لا طبعا هذي الcopy من الagreement تفضل فالمطعم الام وقع معاهم وقع معاهم مع فهد مع فهد, لا طبعا هالي الكابي من الأقيم تفضل فالمطعم الام وجع معهم وقع معهم مع فهد مع فهد
saudi arabia ksa كذا مذكورة saudi arabia ksa kingdom of saudi arabia ksa, ksa كذا مذكورة سادي ارابيا ksa
ok ما ماقدروا يلاحقوه ولا يجيبوا شيء خلاص العوض الله يعوض الله يعوض, اوكي ما قدروا يلاحقوا ولا يجيبوا شي خالص العود لنا الله يعود
وانه العقد يشمل المملكة العربية السعودية ksa, وأن العقد يشمل المملكة العربية السعودية ksa
ما عاد فيه الرجال هذا وهذاك قفل أصلا المطعم الأساسي اللي فلندن قفل في ال june may الفين وخمسطعش احنا فتحنا في سبتمبر الفين واربعطعش, معد في الرجال هذا وهذا قفل أصلا مطعم الأساسي اللي في لنزل قفل في جون ماي 2015 إحنا فتحنا في سبتمبر 2014
احنا حتى ما جانا العلم ولا الخبر ولا بلغنا وليش لأن فالagreement عندنا وش تقول, احنا حتى ما جانا العلم ولا الخبر ولا بلغنا ليش لن في الاجريمنت عندنا واش تقول
based on نوزومي لندن فكل شيء مرتبط بنوزومي لندن فهو مايبغى يبلغنا, based on نظومي لندن فكل شيء مرتبط بالنظومي لندن فهم يبغى يبلغنا
قال لا انا مختلف مع الland lord والحين استأجرت موقع ثاني وجالس انقل ok جالس ينقل خلاص الرجال جالس ينقل, قال له أنا مختلف مع الـ landlord والحين استأجرت موقع ثاني وجازة انقلي أوكي جازة انقل خلاص صار رجال جازة انقل
سا كانت قصة عجيبة وهذي كانت شرارة الreal banding ايوه لمن تواصلنا معاه على جدة قلنا له انت وقعت في جدة, كانت قصة عجيبة هذي كانت شرارة الـ إيضا لما تواصلنا معاه على جده كنت له أنت وقعت في جدة
انت سويت breach جيت انت ما بتضيف للbrand عندنا ولا شيء لما فتح هو في قطر, انت زوت بريج جيت انت ما بتضيف للبراند عندنا ولا شيء لما فتحه في قطر
ما كان عنده نوزومي لندن و وقع في الفردان في kempinski في في قطر, ما كان عنده نزوم لندن ووقع في الفردان في كمتنسكي في قطر
مسؤولية ولا شيء مسؤولية ولا لنا income ولا fees ولا شيء تدربوا عندنا موظفين, مسؤولية ولا شيء مسؤولية ولا لنا income ولا fees ولا شيء تدربوا عندنا منظفين
ولا اخذنا منه ولا شيء for the sake of the relation العلاقة لأنه الشراكة هي الشراكة هي شراكة طويلة الأمد فأنت تفكر فيها مع شريكك ماتفكر فيها في خلافات من البداية, ولا أخذنا منه ولا شيء فوردس هي كونت الرليشنشيب العلاقة لأن الشراكة هي شراكة طويلة الأمد فأنت تفكر فيها مع شركك ما تفكر فيها في خلافات من البداية
قلنا له هنا كانت هذي في october الفين وسبعطعش, هنا كانت هذه في أكتوبر 2017
إيقاف العقد لسبب أسباب الbreach اللي انت قاعد تسويها, إيقاف العقد لسبب أسباب البريتش التي كانت تسويها
اولا نوزومي لندن does not exist فال فالاتفاقية غير مفعلة, اولا نزوم لندن does not exist فالاتفاقية غير مفاعلة
طيب ومافيه اي zero support ولا فيه system كل الأشياء اللي تنص عليها الfranchise هذي zero ماهي قاعدة تجي, طيب وما في اي zero support ولا في system كل الاشياء اللي تنص عليها الفرانشايز هذي zero ما هي قاعدة تجي
نص الmenu اللي تشوفه from day one تطويرنا حنا, نص المني اللي تشوفوا from day one تطويرنا حنى
ok انه لمن نطور أشياء معينة اللي هي الbest sellers اليوم في ميازو واللي كانت في نوزومي هذي تطويرنا احنا ما اخذناها من, اوكي انه لما نطور اشياء معينة اللي هي البستسلر اليوم في ميازه واللي كانت في نزومي هذه تطويرنا احنا ما اخذناها من
فبس عشان تكون على بينة ok فا, فبس عشان تكون على بينا أوكي فا 
على brand جديد, على بران جديد
الbrand جديد هذا يحل محل مس, البراند جديد هذا يحل محل مسؤول
فعينا شركة متخصصة فالbranding, فعيننا شركة متخصصة في البراندنغ
اء كانت متخصصة فالfashion branding بالتحديد وليس فيه مجال المطاعم, كانت متخصصة في الفاشن من عندك بالتحديد وليس في المنجام الطاعب
فالfashion branding boutique company very small company boutique مقرها في باريس في فرنسا, في الفاشين براندنج بوتيك كمبني مقرة ها في باريس في فرنسا
سنتين لين ماسوينا full brand اسمه ميازو, سنة تيم لما سوينا فل براند اسمو ميازو
وميازو ما كان rebrand او rename سجلنا ميازو لأنه فيه هدف عندنا وش هي الفكرة اللي عندنا موجودة انه ميازو باذذن الله يطلع فكل, وميازو ما كان re brand أو rename سجلنا ميازو لانه فيه هدف عندنا وفيه الفكرة اللى عندنا موجودة انه ميازو بإذن الله يطلع في كل
ان شاءالله نطلع وانه يطلع brand سعودي اسمه ميازو, ان شاء الله نطلع وانه يطلع براند سعودي اسمه ميازو
ل ماكان وقتها محدد الاسم بس انه يطلع brand سعودي يمثل زي ما لأنه, ما كان وقتا محدد الاسم بس أنه يطلع بران سعودي يمثل زي ما لأنه
جاتنا الفكرة اللي هي الثانية انه زي ما احنا قاعدين نجيب من برا franchise, جتنا الفكرة اللي هي الثاني انو طيما احنا قاعدين نجيب مطعم بر ر فرنش هذي
بحيث أنه يتأكد من اليابان إلى أمريكا عشان حتى ماحد يقول أخذتوا الاسم copy من اليابان الاسم, بحيث أنه يتأكد من اليابان إلى أمريكا عشان حتى ما حد يقوله اخذته الاسم copy من اليابان الاسم
we launched it في قبل الان ان شاءالله في ديسمبر نكمل ثلاث سنوات فيه ديسمبر عشرين عشرين, we launched it في قبل الآن ان شاء الله في ديسمبر نكمل ثلاث سنوات في ديسمبر 2020
اء سان كارلو شيكتي وقعنا له سان كارلو group اللي تملك سنيور ساسي اسمها سان كارلو group عندهم مجموعة مطاعم, سان كارلو جاكتي وقعنا له سان كارلو جروب اللي تملك سنيورساسي اسماه سان كارلو جروب عنده مجموعة مطاعب
ok بbrands مختلفة هذي سان كارلو group احنا وقعنا مع سان كارلو group, برانز مختلفة هذه سان كارلو جروب احنا واقعنا مع سان كارلو جروب
اء بين كارلو الowner حق سان كارلو, بين كارلو الأونر حكسان كارلو
أمريكانا فقال حتى لو ما فتحوا بس انا استحي اني اروح اطلبه release, أمريكانا فقال حتى لو ما فتحوا بس أنا أستحن أني أروح أطلبو إن يعطيني release
تواصل معانا قال الآن خلاص تقدر تأخذه ال agreement لأنهم يعني مافيه احد, تواصل معانا قال للآن خلاص تقدروا تأخذوا الاكريمت لأنهم يعني ما في أحد
وقال ما لا يمكن أرجع له او اكلمه او ارفع عليه السماعة او احطه تحت pressure, وقال ما رأى لا يمكن أرجع له أو أكلمه أو أرفع عليه السماعة أو أحطه تحت بريشر
في محل نوزومي حق الcatering, في محل نزومي حق الكاترينغ
سبحان الله مكتبنا موجود فوق urth cafe اللي فالتحلية, سبحان الله مكتبنا موجود فوق إيرث كافيلر التحذي
ok هذا كان حنا مستأجرين المبنى كامل فبالتالي يسهل علينا الإدارة, أوكي هذا يمكننا استأجرنا البنى كامل فبالتالي يسهل علينا الإدارة
شلنا نوزومي catering طب وش نسوي فالموقع ايه, طب وش نسوي في الموقع 
ok ايش نسوي فالموقع الموقع حنا نفتح unclear يا سلام فحطينا فالموقع عساس, اوكي اش نسوي في الموقع الموقع حالا نفتح يا سام فحطينا في الموقع عشان
ماهو بنفس الsegment حقت ميازو ولانوزومي في ذاك الوقت it s a casual كا هذولي الثلاثة, ما هم نفس السيجمنت حقت ميازو ولا نزومي في ذاك الوقت اتس كاجول هذاور الثلاثة
فال فالgroup وعندك ستة براندات ثانية اللي جت بعدهم خسرانين, وعندك ستة براندات ثانية اللي جت بعدهم خسرانين
ok يربحون وليش الستة الاخرين قاعدين يخسرون ok طبعا اء, أوكي يربحون وليش الستة الاخرين قاعدين يخسرون أوكي طبعا 
خدم الbrands هذيك بعدين لما جت كورونا, خدم الـ brands هذيكة بعدين لمن جدت كورونا
ok هذي ال في عشرين عشرين جت كورونا اخر التسعطعش بس في عشرين عشرين, هذي في 2020 الجوت كورونا آخر 19 بس في 2020
ok المالي هذا أثرها المالي نقطة وبعدين يجي المعروض, أوكي المالي هذا أثرها المالي نقطة وبعدين يجي المحروف
انت في سوق حر ماتقدر تجي تقول شركات لا تفتح مطعم وما تقدر تجي تقول تسوي zoning, انت في سوق حر ما تقدر تيجي تقول شركات لا تفتح مطعم وما تقدر تيجي تقول سوي زوننغ
فالنهاية اقتصاد حر من حقه انه يأخذ تصريح ويفتح مطعم هو صاحب القرار ok فصار فيه معروض ومعروض من القطاع الخاص, في النهاية القصاد حر من حقه انه ياخد تصريح ويفتح مطعم هو صاحب القرار أوكي فزار في معروض معروض من قطاع الخاص
والdemand جالس يزيد بس بالتدريج, والدمان جاهز يزيد بس بالتدريج
طلب حجز في billionaire, طلب حجز في بليونير يا ستر تدخل لا ميازه
اء ماعرف سوي جربنا الshow بعدين لقينا comments كثيرة انه الshow, ما عرف سوي جربنا الشو بعدين لقينا comments كثيرة انه الشو
اء ممل ومتكرر وقفنا الshow, ممل ومتكرر وقفنا الشو
لمن وقفنا الshow الان تجينا طلبات انه رجعوا الshow, لما وقفنا الشو الآن تجينا الطلبات إنه رجع الشو
الشركة اللي جايبينها عشان نسوي الshow هي شركة في اسبانيا, الشركة اللي جايبينا عشان تسوي الشو هي شركة في اسبانيا
هل المساحة الملمومة والناس سعر لما والسعر ok السعر في شيكتي, هال المساحة الملمومة والناس السعر لم تأتي والسعر السعر في جيكتي
فهو يعتبر casual, هو يعتبر casual
اكثر من انه يعتبر fine dinning لكن ال quality اللي جالس اعطيك إياها, اكثر من انه يعتبر find dining لكن ال quality اللي جايس اعطيك اياها
نفس الquality اللي جالس اعطيك اياها فسنيور ساسي ال ingredients اللي انا استخدمها, نفس الكوليت اللجهة سيعطيك يا حافسينيور سعسي الانغريدينس اللي نستخدمها
هي نفس ال ingredients عملنا ما نأخذ نوعين من ال ingredients او two level من الingrediants, هي نفس الingredients عما انها ما استخدم نوع من ingredients أو two level من ingredient
very high quality ingredients بس نزل من cost of operation اقل انه مطعم اصغر فعدد موظفين اصغر فا, very high quality ingredients بس انزل من cost of operation اقلة منه مطعم اصغر فعدد الموظفين اصغر
بس مو ما رخصنا فال ingredients هي نفس ال ingredients فا بالنسبة للناس شيكتي value for money, بس ما رخصنا في الانجريدين سهي نفس الانجريد فبالنسبة للناس شكتي value for money
أربعة وثمانين طباخ ايه موب واي ما يشمل الstaff الخدمة, طباخ ايه موبويت ما يشمل الستاف الخدمة
ال ايش بس فالback of house فالمنطقة المطبخ, بس في الباكوف هاوس في منطقة المطبخ
أربعة وثمانين أربعة وثمانين وكم اللي يشتغلون في تقديم الخدمة الtotal مية وثلاثة وخمسين شخص يشتغل في سنيور ساسي, 84 وكامل يشتغلون في تقديم الخدمة التوتل 153 شخص يشتغل في سينيورساسي
