gt,hyp
الله يقويكم so بس بشكل عام وش يعني كيف تفسر هذي so كرة القدم يعني زي ما قلت لك الرياضة هي جزء من الثلاث طعشر قطاع اللي, الله يقويكم بس بشكل عام مش يعني كيف تفسر هذا الشيء سوكروت القدم يعني زي ما قلت لك الرياضة هي جزء من الثلاثاشه القطاع اللي آآ
why the epl ليش الدوري الإنجليزي لأنه هو اعظم دوري موجود الآن فالعالم, why the epl ليش دوري الإنجليزي لأنه هو أعظم دوري موجود الآن في العالم
ثلاثة فرق يصير لها relegation وثلاثة فرق يصير لها promotion ناس ثلاث فرق تنزل وثلاث فرق تصعد من الدوري اللي تحته, ثلاثة فرق يصير لها relegation ثلاثة فرق يصير لها promotion ناس ثلاثة فرق تنزل وتثلاثة فرق تسعد من الدور اللي تحت
منافسة عالية منافسة جدا عالية هذا معناته مشاهدات أعلى بالضبط so, منافسة عالية منافس جدا عالية فهذا معاتم مشاهدات أعلى وبعدت بطب
لما ناظرنا لها نظرنا لها من ناحية مالية and by the way it wasn t the first, لما نظرنا لها نظرنا لها من ناحي مليا and by the way it wasn t the first
offer يجينا على فريق شفنا في إيطاليا وشفنا في فرنسا, وفريجين على فريق شيفنا في إيطاليا وشيفنا في فرنسا
only ثلاثين فالمية ومالنا أي علاقة فالإدارة, only 30 وما انها اي علاقة فالادارة
وحنا اشترينا newcastle, وحين نشترينا نيوكاسل
كان معروض علينا مية بالمية لكن اء اللي جابوا لنا الفرصة amanda sevry هي وزوجها, كان معروضا لنا 100 لكن اللي جابونا الفرصة راماندا سيفلي هي وزوجها
قالوا we would we like it so much we would like to be with you قلت ممتاز, جيدا نحن نحن بشكل كثيرا نريد أن نكون معكم ممتاز
بعدين جو الrobin family اللي هم من اكبر المطورين العقاريين قالوا we would like to come with you هم من اكبر المطورين فnewcastle قلت ممتاز, بعدين جوا الروبن فاملي اللي هما من أكبر مطورين العقاريين قالوا we would like to come with you وهم من أكبر مطورين في نيو كاسل قلتم تاز
خلهم يجون فا they have now skin in the game يعني skin in the game صاروا جزء من النجاح ومن الفشل exactly, خلهم يجون فـ they have now skin in the game صاروا جزء من النجاح ومن الفشيل
شرينا الفريق كامل بثلاث مية وخمسين versus ثلاث مية ثلاثين بالمية بسبع مية اء اء مليون, سرين الفريق كامل 350 versus 300 30 ب700 مليون
versus تشيلسي توه منباع, versus chelsea تو من برء
is to go from ثلاث مية وخمسين الى على الاقل ثلاثة three point five that s ten times the money, is to go from 350 إلى على الأقل 3 5 that s 10 times the money
versus لو اشتريته اليوم كم بيطلع اربعة مليار خمسة مليار, versus chills لو اشتريته اليوم كم بيطلع اربع مليار خمسة مليار
ما مايجيب لك اقل من مئة فالاختيار استثماري بحت استثماري بحت so that s why one number two newcastle, في الاختيار استثماري بحث استثماري بحث number two newcastle
يعني معظم المدن فيها أكثر من نادي newcastle كل newcastle وراك, يعني معظم المدن فيها اكثر من هذه نيو كاسل كل نيو كاسل وراك سعمية وخمسين الف تقريبا واكثر من مليون في المنطقة
تسع مئة وخمسين الف تقريبا واكثر من مليون في المنطقة موجودين كلهم fans, موجودين كلهم fans
we have now تقريبا between fifty two thousand seats فالملعب, we have now between 52000 seats في الملعب
كلها sold out يعني لما تنظر لها من كل النواحي اللي موجودة الpotinitial اللي موجود عندنا الان مثلا chef of the chefs strategies, كلها صولدارت يعني لما تنظر له من كل النواحي الموجودة الـ potential اللي موجود عندنا الام مثلا الـ chief of the chief strategist
مع الinternational,
investments their lookingعلى الأشياء العقارية والinfastructrue اللي بنسويها إن شاء الله, investments they re looking على الأشياء العقارية والإنفرستراكتشر اللي بنسويها إن شاء الله
في المنطقة فالpotential , في المنطقة فالpotential كـ
goin forward للاستثمار الرياضي حقنا, going forward للإستثمار الرياضي حقنا
بتكون صعبة الا اذا اخذنا some incubators يعني اندية اصغر علشان to incubate into this, بتكون صعبة إلا إذا أخذنا some incubators يعني عندي أصغر علشان to incubate into this
مالها حس هل هي متعثرة هل فيها مشاكل وش قصة المحفظة العقارية روشن is doing extremely well overlapping speech روشن تبع الgiga project ماهي تبع المحفظة العقارية, ما لا حس هل هي متعثرة هل فيها مشاكل وش قصة الحقارية رواشن يزدون بأكستيم لواء رواشن تابع القيجا بروژيكت مهي بتبع المحظر الحقارية
انا أتكلم مثلا على تطوير وسط المدن نتكلم عن رؤى الحرم المكي نتكلم روشن ترا بدت هناك وانتهت هناك وكبرت راحت هناك كانت لأنه الأول الmandate حقها كان اقل بعدين كبر الmandate, أنا تتكلم مثلا على تطوير وسط المدن تتكلم عن رؤى الحرام المكي راش انت رأى بدت هناك ونتهجت هناك كبرت راح تناك لأن الأول mandate حقها كان أقل بعدين كبر mandate
فانتقلت فانتقلت الى الgiga projects بالنسبة للمحفظة العقارية, فانتقرت إلى الـ giga projects بالنسبة لمحفظة العقارية
فيه عندنا مشاريع كثيرة فالpipeline, في عند المشاريع كثيرة في البايبلين
وقت طويل فالplanning خاصة if you want to have the right, وقت طويل في الـ planning خاصة إذا كنت تريد أن تكونوا على المستقبل
models والright plans وكيف تقدر, وكيف تقدر
تخلي الplans, تخلي البلانز
فإذا تبغى تطورها هناك كيف تقدر تطورها ايش هو الproposition تخلي المدن والقرى اللي حولها يجون لها, فإذا تبقى تطورها هناك كيف تقدر أطورها إيش هو الـ proposition تخلي المدن والقرى اللي حوله يجو له
 same thing مثلا في نجران, same thing مثلا في نجران
انعرض كذا موقع ومواقع هذي مثلا وزارة البيئة كانوا يبونها وزارة وزارة أخرى كانوا يبونها فا it takes time, نعرض كذا موقع ومواقع هذة مثلا وزارة البيئة كانوا يبونها وزارة اخرى كانوا يبونها فـ it takes time
علشان تأخذ الlogistics هذي and it takes time to find right design, علشان تاخذ اللوجستكس هاذي and it takes time to find the right design
and the right proposition بالنسبة لل انها تخليها, and the right proposition بالنسبة لأنها تخليها
how can we modernize الطراز السلماني, how can we modernize الاضطراج السلماني 
design غيرنا كثير من ال ال designers اللي ممكن يجون ولهم خبرة مناسبة, اه designs غيرنا كثير من ال designers اللي ممكن يجون ولهم خبرة مناسبة
وthe same thing is applicable مثلا لي اللي بنسويه في الخرج اللي بنسويه في القطيف اللي بنسويه في مكة, و the same thing is applicable مثلا اللي بنسوي في الخرج اللي بنسوي في القطيف اللي بنسوي في مكة
يعني ok maybe it looks good بس, يعني okay maybe it looks good
فا yeah هذي الأشياء تأخذ وقت بعدين,
يوم تشتغل مع الdesigners مع المهندسين it takes time يعني هذا الأشياء يعني i will give you an example اللي هو كافد, اليوم تشغل مع الديزاينرز مع المهندسين it takes time يعني هذا الأشياء and i will give you an example اللي هو الكافت
it was supposed to be delivered في الفين واثنعش الى الان it s not fully operational, انها ستجعل في 2012 إلى الآن لا تقوم بعمل
طريقة الplanning كانت, طريقة البلاننج كانت
يعني تشوف العماير اللي موجودة ok the on الشيء الواصل الوحيد بينها اللي هي الجسور الجسور اللي موجودة بس ما, يعني تشوف العمار الموجودة اوكي الشيء الوصول الوحيد بينها اللي هي الجسور اللي موجودة بس ما او
يعني لما تجي على الefficiency اللي موجودة في بعض العماير, يعني لما تيجي على الإفشنسي اللي موجوده في بعض العماير
تلاقيها اقل من خمسين بالمية الefficiency اللي هي, تقوم بالمئة الإكامية اللي هي الأشياء
الaverage فالعالم مابين خمسة وسبعين الى خمسة وثمانين بالمية, الأفريج في العالم ما بين 75 و 85 
في أقل من خمسين أقل من خمسين yeah, أقل من خمسين
as long as أنه التنفيذ عندنا بيكون, as long as الم التنفيذ عندنا بيكون
طبعا فيه عندك الخطوط السعودية وفيه flynas وفيه كذا شركة خاصة للخطوط, طبعا في عندك الخطوط السعودية وفي flynet في كذا شركة خاصة للخطوط
الخطوط السعودية بالشركات الخطوط العالمية المتقدمة مثل الان كان singapore air, الخطوط السعودية بالشركات الخطوط العالمية متقدمة مثل ا كامت سنجابور إير
وبعدين جات طبعا الemirates الإماراتية, وبعدين جات طبعا الامريتز الاماراتية
نقطة الخلاف الأساسية اللي هي one hub, النقطة الخلاف الأساسية اللي هي one hub
ولا multiple hubs, ولا multiple homes
الخطوط السعودية المفروض عندها three hubs, أعتقد سعدي مفروض عندها 3 hubs
إذا تبغى تنجح لازم يكون عندك one hub, إذا توقع تنجح لازم يكون عندك one hub
وبعدها يعني direct flight مثلا من الرياض نفرض ان الخطوط بتكون الhub حقها الرياض, وبعد يعني direct flight مثلا من الرياض نفرض أن الخطوط بتكون الهب حقيا الرياض
بس ما تقدر تجي مثلا من عرعر إلى نيويورك direct, سما تقدر تيجي مثلا من عرعر إلى نيويورك داريك
أو من عرعر إلى عمان direct يمكن بس, او من عارة الى عمان دايركت يمكن بس
أفضل أنه يكون عندك one hub, أفضل أنه يكون عندك ونحب
so الخطوط اللي بتكون موجودة it s one hub, so الخطوط اللي بتكون موجودة it s one hub
الfleet اللي بيكون موجود, الفليت اللي بيكون موجود
فا علشان تقدر يكون فيه عندك efficiency للطيارين قطع الغيار exactly الصيانة نفس الشيء الcatering everything else, فعلشان تقدر يكون في عندك efficiency للطيارين قطع الغيار برضو exactly الصيانة نفس الشيء الكيترينج everything else
going back للmethodology اللي احنا عادة نتبعها فالصندوق, going back للمثوديولوجي اللي احنا عادة نتبعها في الصندوق
وهذا اللي جالسين نسويه وفيه ناس تقول طيب ليش ما صلحتوا الخطوط السعودية ليش ما استثمرتوا فيها وانطلقتوا من هناك الخطوط السعودية جالسة it s serving what aيعني الأشياء اللي موجودة, وهذا اللي جعل سوي وفي ناس تقول طيب ليش ما صلحت الغطوة السعودية ليش ما استثمرته فيها وانطلقته من هناك الغطوة السعودية just it s servant word يعني الاشياء الموجودة
لكن again the business model حق الخطوط السعودية, لكن again the business model حق الخطوط السعودية
اللي هي الmulti multi hub, اللي هي multi hub
الخطوط الأمريكية معظمها متعثرة because عندهم multi hub, خطوط الامريكية ما اضمها متعثروا بكوز عندهم مالتيهوب
فا هي الخطوط الجديدة حتكون من الرياض single hub, فهي الخطوص الجديدة هتكون من الرياض single hub
فئة business ولا فئات يعني it depends on the demand طبعا you can t have طيارة كلها business يعني سوتها الظاهر, فئة بيزنس ولا فئات يعني it depends on the demand طبعا ما بإقناتها في طياره كلها بيزنس يعني سوتها الضهر
فا i i don t think it s the right propositionمتى متوقع انطلاقها, فأنا لا اعتقد انها هي المحلقة متى متوقع انطلاقها 
yeah والمطار ال خلاص ال , والمطار خلاص
الceo جاينا ان شاء الله خلال شهر او,
and they don t have to be سعوديين فقط, and they don t have to be سعودين فقط
softbank يمكن هو من أكثر الاستثمارات المثيرة, يمكن هو من أكثر الاستثمارات المثيرة
واللي ذكر في لقاء مع david, واللي ذكر في اللقاء مع ديفيد
كنت تقول انك rubenstein ايه كنت تقول انك مبسوط لأنه حققوا لك تسعة مليار, كنت تقول انك مبسوط لانه حقي قولك 9 مليار
دولار عوائد في ذيك اللحظة yeah, دولار عوائد في ذي كلحظة يأ
بعد الخساير اللي قاعد يمنى بها الصندوق yeah ال يعني لما, بعد الخسائر اللي قاعد يمنى بها الصفية يعني لما ت
 softbank vision fund let me just take maybe few steps back ياليت بس اعطيك some context, softbank vision fund let me just take maybe a few steps back let s take some context
كيف دخلنا فا softbank, كيف دخلنا في softbank 
so اتذكر يعني من الsessions اللي كنت اجلس فيها مع سمو ولي العهد, اذكر يعني من الـ sessions اللي كنت اجلس فيها مع اسمولي العهد
نتكلم عن الaspirations اللي موجودة وش نبغى نسوي فالصندوق, نتكلم عن الaspirations الموجودة وش اللي بتسوي في الصندوق
فا كان he was always referring ل يرجع يقول, فكان he was always referring لي يرجع يقول
نبي نكون فالartificial intelligence الذكاء الاصطناعي نبي نكون فالrobotics, نبي نكون في الartificial intelligence ذكال الصنائي نبي نكون في روباتيكس
نبغى نكون فالlife science, نبغى نكون في اللايف ساينس
نبغى نكون فالinternet of things , نبغى نكون في الانترنت of things
حنا again يعني يمكن انت تكلمت قبل كذا على الاقتصاد القديم والاقتصاد الجديد, again you mentioned i talked about this on the economic and economic and economic and economic
 it happened أنه قابلت تقابلت انا مع sama masa son, it happened in a couple of months
أغنى رجل فالعالم back in nineteen ninety nine بضع ساعات, بضع ساعات
خسر تقريبا ninety seven percent of ثروته ورجعها في استثماره علي بابا, خاسر تقيبا 97 off ثروته ورجع في استثماره في
so masa تكلم عن الرؤية حقته وقال i m gonna put, so masa تكلم عن الرؤية حقه وقل ام ام gonna put
ثمانية وعشرين مليار بيحطها دولار في fund, بحطها دولار في فاند
اللي هي internet of things robotics, اللي هي انترنت of things robotics
artificial intelligence مفصلة عليكم and life science , artificial intelligence وفصل عليك and life science
قلت له ok وبدأ يتكلم هنا وهنا, بدأ يتكلم هنا وهنا
فا تكلمت مع الأمير قلت له i have this guy who i met before و i met him في في طوكيو, فتكلمت مع الأمير قلت له i have this guy who i met before و اي ماتهم في طوكو
اذا مافيه عندك مانع تشوفه قال ok ممتاز, إذا ما في عندك مالعة تشوفه قال اوكي متاز
so جاء شافه, so جاء شافوا و 
الأمير يعني مرة قال ok, دمير يعني مرة قال اوكي
is forty five billion what you want احنا نستثمرها, is the 45 billion what you want احنا نستثمرها
ليه قال الأمير هذا الشيء على الرؤية that s one, ليقى الأمير هذا الشي على الرؤية that s one
number two كنا جالسين نتكلم نبغى نستثمر, number two كنا جاسين اتكلم نبوان استثمر
كيف نقدر نوصلها ثلاثين بالمية by the way الحين نزلناها الى range unclear between twenty to twenty five, كيف نقدر نوصل إلى 30 by the way الحين نزلنا إلى range between 20 to 25
no singal asset manager موجود اليوم, no single asset manager موجود اليوم
فهذا من الأسباب الأساسية اللي اللي دخلنا فيها مع softbank vision fund, فهذه من الأسباب الأساسية اللي دخلنا فيها مع softbank vision fund
الproposal اللي كان موجود وبالتأكيد مع انخفاض الأسواق العالمية الآن, اللي كان موجود وبالتأكيد مع انخفاض الأسراء العالمية الان
الperformance حقهم أقل و أتذكر أنك قد طلعت أظن financial times كانت تقول بأنه, performance حقا ما قل واتذكر انا قد طلعت اظن financial times كانت تقول بانه
استثمار السعودية فال vision fund, استثمار السعودية في الفيشن فاند
ايه وفيه so we invest in two things, أيه وفي نعم نتعلم في دو مئة
فالpreferred وفالequity,
 الpreferred فيه عندنا سبعة بالمية, الpreferred في عندنا 7 
بس we don t take the upside يعني هذا بس المضمون, بس we don t take the upside يعني هذا بس المضمون
والباقي يكون فالequity الequity فال تعرف كم التقسيمة تقريبا وش اكثر ماكنت غلطان هي خمسة وعشرين خمسة وسبعين, والباقي يكون في الاكوتي الاكوتي في تعرف كم التقسيمة تقريبا وش اكثر ما كانت غلطان هي 25 75
 او ثلاثة وثلاثين ستة وستين im really not sure بس وش الاكثر,
الأكثر اللي هو المضمون الpreferred yeah اه ok فأنتوا صار لكم خمس سنوات تأخذون هذا ال النسبة الثابتة yeah, الاكثر اللي هو المضمون اه البريفير اوكي فأنتو صار لكم خمس سنوات تاخدون هذا النسبة الثابتة يعم
ok و في القادم من الأيام شفنا أنه ما تكررت التجربة وصرتوا انتوا تروحون تستثمرون بشكل مباشر, اوكي وفي القادم من الايام شفنا انه ما تكررت التجربة وصدت انت تروحوا انت استثمر بشكل مباشر
ل نظرا لأنه ما كانت مجدية ماهي مرضية no no شوف, لاظرا لأنو ما كات مجدية ما هي مرضية نونونون شوف
يوم when we started كان عدد الموجودين في صندوق الاستثمارات العامة يمكن مية مية وخمسين شخص today were like, يوم when we started كان عدد الموجودين في الصندوق الإثمارات العام ممكن 100 150 شخص today we re like
إضافة لذلك our direct investment اليوم افضل بكثير performance حقها, إضافة لذلك our direct investments اليوم أفضل كثير performance حقها
اليوم عندنا office in new york office في london, اليوم عندنا آآآآآآآآآآآآآآآآآآآآآآآآآآآآآآآآآآآآآآآآآآآآآآآآآآآآآآآآآآآآآآآآآآآآآآآآآآآآآآآآآآآآآآآآآآآآآآآآآآآآآآآآآآآآآآآآآآآآآآآآآآآآآآآآآآآآآآآآآآآآآآآآآآآآآآآآآآآآآآآآآآآآآآآآآآآآآآآآآآآآآآآآآآآآ
office في hong kong so this will give us access, أوفيه هونقوم so this will give us access
لل deal flow,
will give us access لل الناس بيكون موظفين طبعا من الصندوق إضافة لموظفين, will give us access للناس بيكون موظفين طبعا من الصندوق اضافة لموظفين
and to be active فال investments هذي , and to be active in investments هذه
متى نقدر نشتري سياراتنا فالرياض lucid, مت هنقدر نشتي سيارتنا في الرياض لوسيد
موجودة بس ما تنباع لسا الا جبنا كم so المشكلة الأساسية في, موجودة بس ما تمبع لسه الا جبنك so المشكلة الاساسية في
فيها وطبعا it s a listed company ماقدر اعطي تفاصيل عنها اكثر لكن على حسب, وطبعا تسالستد كنبرية ما قدر أعطي تفاصيل عنها أكثر لكن على حسب
 المعلومات العامة متأخرين كثير فالإنتاج متأخرين على شان الsupply chain, متأخرين كثير في الانتاج متأخرين علشان supply chain
there still يعني جالسين يتعاملون مثلا lucid كلها قزاز صح, there s still يعني جاسين يتعاملون مثلا lucid كلها قزاز صح
يعني من ذا الone shield من قدام ومن وراء والسقف, يعني من الويندشيلد من قدام ومن وارا والسكف
so الناس اللي يقدروا يسووا هذي الخدمات قليلين, صول الناس اللي قدروا يسوى هذه الخدمات قليلين
and فيه الquality assurance مشاكل فيها يعني لازم تكون كل شيء hunderd percent عشان لا يصير لها recall ولا ذا, and feel quality assurance مشاكل فيها يعني لازم تكون كل شيء 100 عشان لا يصير له ريكور ولا اذا
غيرت كثير من الprocesses والأنظمة حقتهم, غيرت كثير من البروستيز والأنظمة حقاتهم
فهذي كل الأشياء لما تجتمع مع بعض تخفف الإنتاج and what im hopping for, فهذه كل الأشياء لما تستمرنا بعد خفت الإنتاج ورم هوبن فور
what am hopping for أنه to achieve at least numbers اللي أعلنوا عنها, what i m hoping for you know to achieve at least the numbers اللي إعلانوا عنها
all the incentives اللي جت من جهات عديدة من الحكومة, اللي جت من جهات عديدة من الحكومة
صندوق الصناعي وهذي تعتبر سيارة الطبقة العالية هل ممكن نشوف برضو سيارة كهربائية تناسب الشريحة المتوسطة ايه ايه yeah actually, وهذا تعتبر سيارة الطبقة العالية هل ممكن شوف برضه سيارة كهربائية تراسب الشريح المتوسطة 
فال lucid air اللي هو اللي موجود حاليا, في اللوسيدار اللي هو الموجود حاليا 
لكن eventually we wanna do suvs لأنه نبغى السيارات اكثر, لكن eventually we wanna do the suvs اللي ننبغى السيارات أكثر
