gt,hyp
احنا نبغى نسوي catering بس غي طبيعة الjapanese food انت ماتقدم سخانات تحطها في بوفيه لا it s live coocking, نحن نبغى نسوي كيترينك بس طبيعة الجابانيز فود انت ما تقدم سخنات وتحطها في بوفي لا it s life cooking
وفيها preparation وفيها live coocking on the spot طب معناته نبغى stations, وفيها preparation وفيها life cooking on the spot طبعناته نضغط stations
والstation نبغاها على نفس الديكور حق نوزومي فتم تفصيل stations كاملة وقتها صمم لنا اياها, والستيشن نبغاها على نفس الديكور حق نزومي فتم تفصيل ستيشن كاملة وقتها أصمم لنا ياها
يصممها ويصنعها في في لندن تم تصميمها بالكامل جبناها جبنا الtruck كانت heavy equipments, صميم هو يصنعها في لندن تم تصميمها بالكامل جبناها جبنا الترك كانت هيفي اكوبمنس
اء وكنا نسوي catering وسوينا catering مرة كثير سوينا في بيوت, وكننا نسوي كاترينغ وسوينا كاترينغ مرة كثير سوينا في بيوت
خاصة يعني حفلات عشاء خاصة و و الى اخره نفس ال experience اللي تأخذها فالمطعم, خاصة يعني حفلات عشاء خاصة وهاوة الاخرية نفس الإكسبرينز اللي تأخذها في المطعم
نفس بالطاولات foldable legs الطاولات اللي هي تتطبق بس نفس الخشب, بالطولات foldable legs الطولات اللي هي تطبق بس نفس الخشب
اء الكراسي نفس الكراسي بس foldable عشان تتجمع وتروح وتنحط, الكراسي نفس الكراسي بس foldable عشان تتجمع وتروح وتنحط
فأنت تأخذ ال experience اللي تأخذها فالمطعم تأخذها في الحفلة الخاصة ok او مكانك الخاص مزرعة بس ما كملتوا ليش, انت تاخذ الإكسبيدينس اللي تاخذه في المضعم تاخذها في الحفلة الخاصة أو المكانك الخاص مزرعة بص ما كملته ليش 
اء تكلفة ال operation كانت ألفين عالشخص انتوا كنتوا أغلى, أكلفت الوبراشن كانت 2000 عالشخص انتم بتوا اغلى
catering كنا ويالله هذا مع مع العلم انه ما كانت تغطي التكاليف, كيترينج ويا الله هذا مع العلم أنه ما كانت غض التكاليف
number two لأن انت عندك fixed coast لمن تعين موظفين فأنت معناته تكلفة ثابتة salaries اذا ما جاتك catering, number two لانه انت عندك fixed cost لما انت عين موظفين فانت معناته تكلفة ثابتة salaries اذا ما جاتك catering فانت
انت zero revenue وعندك تكلفة ثابتة جالسة تطلع, انت زينجوا ريفنيو وعندك تكلفة هاتجاسة تطلع
الشيء الثاني وهذولي chef of ومقدمين الخدمة لأنه يطلعوا chefs ويطلعوا service اثنين مع بعض الteam, شيء الثاني وهذا اللي شفوف وكلهم ومقدمين خدمة لأنه يطلعوا شيفس يطلعوا سيرفس اثنين مع بعض التيم
طبعا هذا فادنا في احنا في business المطعم لأن احنا الاساس هو المطعم وليس الcatering, طبعا هذا فادنا في احنا في بزنس مطعم لانه احنا الاساس هو المطعم وليس الكيترينك
وخف الطلب على الcatering صار الطلب ال catering very exceptional, وخف الطلب على الكاترينج صار الطلب على الكاترينج very exceptional
ok والله ركزنا قلنا خلاص الcatering نبغى نوقفه نوقف الcatering اليوم احنا موجود عندنا catering, اوكي والله ركزنا وقدنا خلاص الكيترينج نبغى نوقف نوقف الكاتيرينج اليوم احنا موجود عندنا كاتيرينج
بس بطريقة مختلفة ماعاد فيه ال stations اللي احنا نوديها, بس بطريقة مختلفة ما عاد في الستاشن اللي احنا نوديها
حنا نروح لcatering اذا انت عندك المطبخ مجهز, إحنا نروح لكاترينج إذا أنت عندك المطبخ مجهز
ok وماهي ماهي عملية, اوكي ما هي عملية 
فنسوي catering و very exceptional ok اليوم بس بطريقة مختلفة, فنسوي كيترينغ وفيري إكسبشنة اليوم بس بطريقة مختلفة
و فنفس الوقت برضو كنتوا شغالين على urth cafe فنفس الوقت ليش ما كان تحت الشركة, وفي نفس الوقت برضو كنت الشغير على أرث كافية في نفس الوقت ليش ما كانت تحت الشركة
urth cafe في كاليفورنيا ليش ما نجيب urth cafe, earth cafe في كاليفورنيا ليش منجيبه وارث كافة 
ok في ذاك الوقت بس مابعد فتحوا في اليابان فقط في كاليفورنيا حتى في أمريكا ماتوسعوا خارج كاليفورنيا نهائيا طيب, أوكي في ذاك الوقت وبس ما بعد فاتحه في اليابان فقط في كاليفورنيا حتى في أمريكا ما توصعه خارج كاليفورنيا نهائيا طيب
اء شركة المأكولات العصرية mfc, شركة المعاكرات العصرية mfc
ok و ابو فيصل, أوكي وابو فيصل
الشركة هذي تا اخذت وقعنا عرفنا هو على الowners للشركة وقعنا معهم franchise agreement, الشركة هذه ده أخذت وقعنا عرفنا هو على الـ owners للشركة ووقعنا معهم franchise agreement
والحمدلله كانت بداية موفقة فتحتوا الفين وسبعطعش الفين في may الفين وسبعطعش فتحنا اول urth cafe اللي فالتحلية, والحمد لله كانت بدائية موفقة فتحته 2017 في مايو 2017 فتحنا أول إيرث كافيلة في التحرية
و urth cafe برضو كان مختلف عن كاليفورنيا, وإيركافية برضو كان مختلف عن كاليفورنيا
لانه عندهم قصة هم برضو مختلفة فالdesigners, لانه عندهم قصة هما مرضو مختلفة في الدزاعنا صح
طلبنا من urth cafe designers اللي عندهم يتعاملون معاه طلع بروفيسور, طلبن من آيرت كافيت ديزانرز اللي عندهم يتعامل معاه طلع professor
اء part time يشتغل في اوقات الفراغ هو بروفيسور فالجامعة, part time يشتغل في اوقات الفراغ هو بروفسور في الجامعة
مهندس بروفيسور architect ok مصمم فالجامعة لما تعاملنا معاه, هندس بروفوسور ارتيتكت أوكي مصم م في الجامعة لما تعاملنا معه
قلنا طب هل احنا نبغاه again نفس urth cafe هذاك يمشي في أمريكا, طب هل إحنا نبغى أجين نفس ارت كافية هذاك يمشي في أمريكا
مو شرط اللي يمشي في اي مكان او في بلد معين او في city معينة بالضروري بنفس الdesign يمشي عندنا, مو شرط اللي يمشي في أي مكان كان أو في بلد معينة أو في سيت معينة بالضروري بنفس الدزاين يمشى عندنا
ok وتكلمنا معاه وسوينا وب يعني بدينا بدايات بسيطة فقط كنا مرة في coya في دبي, وكلمنا معاه وسوينا بدايات بسيطة فقط كنا مرة في كوية في دبي
جميل و و الى اخره مين المصمم هذا تعرفنا عليه لقيناه sagrada group richard المصمم كلمناه, جميل وواء الاخرين من المصمم هذا تعرفنا عليه لقى ساكرادا جروب ريتشارد المصمم كلمنها
قلنا نبغى تسوي معاك cafe قال انا سويت مطاعم كثيرة انا سويت كل lpm اللي فالعالم سويت كل coya اللي فالعالم سويت مطاعم مرة كثيرة, قلنا نبغت تسوي معك cafe قال أنا سويت مطاعم كثيرة أنا سوت كل lpm اللي في العالم سويت كل coil اللي في العالم سويت مطاعم مرة كثيرة
ok بس cafe سويت فنادق بس cafe ماقد سويت, أوكي بس كافي سويت فنادق بس كافي ما قد سوت
قالوا طيب هذي urth cafe في كاليفورنيا مختلفة التفكير مختلف it s home it s add natural عمره اربعين سنة فيه history فيه story behind it it s not a normal cafe as you think, طيب هذه ارث كفية في كليفونيا مختلفة التفكير مختلف its home its natural عمرها 40 سنة فيه history فيه story behind it s not a normal cafe as you think
قلنا له تعرف هو من بريطاني ساكن في لندن قلنا له تعرف قال لا ما اعرف urth cafe يعني i never been to urth cafe, قلنا له تعرف هو من بريطانيا ساكن في لندن قلنا له تعرف قال لا ما عارف ارت كافية يعني i never been to earth kafi
لمدة اسبوعين تزور urth cafe بيستقبلونك هناك الجماعة, لمدة أسبوعين تزور إيرث كافي باستقبلونا كاناك الجماعة
بيأخذوك على كل فروع urth cafe وتفهم وتستوعب the brand, وبياخدوك على كل فروع ايرث كافية وتفهم وتستوعب دبرانت
بأصمم لكم urth cafe قلنا له ممتاز urth cafe is a next bendable, بأصمم لكم إيرث كافي جنالة ممتاز إيرث كافي is an expandable
ونبغى نتوسع فيه قلنا له عشان يكون عندك ال vision هذي from day one, وبنبغو نتوسع فيه بنالوا عشان تكون عندك الفجن هذه from day one
احنا بنوقع معك master agree, احنا بنوقع معك ماستر اقليم
وقعنا معاه master agreement لكل urth cafe من ال kiosks, وقعنا مع ماستر اجريمنت لكل إيرث كافي من الكيوسكس
الى اللي هي kiosks اللي هي صغار ال ال, الى البراج الصغار
ال الفروع المؤقتةالفروع المؤقتة والصغيرة الى الفروع الكبيرة ok, الفروع المواقطة والصغيرة إلى الفروع الكبيرة
وليش لأنه نبغى من البداية يبدأ يفكر انه urth cafe الفرع الثاني مايشبه الاول لكن فيه نفس الروح touches ما يبدأ يفكر في واحد ومايفكر للمستقبل, ولش لأنه نبغى من البداية يبدأ يفكر أنه الفرع الثاني ما يشبه الأول لكن في تاتجز ما يبدأ يفكر في واحد وما يفكر لمستقبل
فيعمل حساباته من البداية وقعنا master agreement, فيعمل حساباته من البداية وقالي مستر أكريمنت
مع انه يوقع لنا انه يصمم لنا urth والله وفعلا راح والحمدلله فتحنا urth cafe اللي فالتحلية, معا انو يوقع لنا انو يصمم لنا ايرث والله فعلا راح والحمد لله فتحنا ايرث يا فعل فتح لي
بداية التحلية قريب من الضباب اء كا كا أول urth cafe هذا الكلام في may الفين وسبعطعش, بداية التحذية قريب من الضباب كأول أرث كافيا هذا كان في ميه 2017
الان اربع طعشر فرع في urth cafe اجمالي including دبي جدة الخبر الرياض, الان 14 فرع في ارت كافياء جمالي انكلودنج دبي جدل خبر رياضي
اء نوزومي pop up هناك, نزومي اتبع هناك
انا لمن عرفت رفعت السماعة على يعني ابو سعود من غير ما اذكر ok يمكن ما يبغى, أنا عندما عرفت رفعت السماع على أبو سعود من غير ما نذكر يعني عشان ممكن ما يبغى
قلت والله العظيم هذي قالي طب فيه مانع الagreement, والله العظيم هذي قال لي طب فيه مانع الاجريمنت
قلت لا طبعا هذي الcopy من الagreement تفضل فالمطعم الام وقع معاهم وقع معاهم مع فهد مع فهد, لا طبعا هل الكابي من الأقريم تفضل فالمطعم الام وق ع معاهما وق ع معاهما مع فهد
saudi arabia ksa كذا مذكورة saudi arabia ksa kingdom of saudi arabia ksa, ساعد ياربيا كاي اسي كذا مذكورة ساعد ياربيا كاي اسي كينجدم في ساعد ياربيا كاي اسي
ok ما ماقدروا يلاحقوه ولا يجيبوا شيء خلاص العوض الله يعوض الله يعوض, اوكي ما قدروا يلاحقوا ولا يجيبوا شيء خلاص العوض لنا الله يعوض
وانه العقد يشمل المملكة العربية السعودية ksa, وأنو العقد يشمل المملكة العربية السودية case i
ما عاد فيه الرجال هذا وهذاك قفل أصلا المطعم الأساسي اللي فلندن قفل في ال june may الفين وخمسطعش احنا فتحنا في سبتمبر الفين واربعطعش, معد في الرجال هادة وهذا قف ل أصلا مطعم الأساسي اللي فلانت قف ل في الجون ماي 2015 إحنا فتحنا في سبتمبر 2014
احنا حتى ما جانا العلم ولا الخبر ولا بلغنا وليش لأن فالagreement عندنا وش تقول, إحنا حتى ما جاءنا العلم ولا الخبر ولا بلغنا ليش لأن في الأجريمنت عندنا واش تقول 
based on نوزومي لندن فكل شيء مرتبط بنوزومي لندن فهو مايبغى يبلغنا, based on nuzumi london فكل شي مرتبط بالنظومي london فهو ما يبغى يبلغنا
قال لا انا مختلف مع الland lord والحين استأجرت موقع ثاني وجالس انقل ok جالس ينقل خلاص الرجال جالس ينقل, قال لا أنا مختلف مع اللاندلورد والحين استأجرت موقع ثاني وجاس أنقلي أوكي جاس ينقل خلاص الرجال جاس ينقل
سا كانت قصة عجيبة وهذي كانت شرارة الreal banding ايوه لمن تواصلنا معاه على جدة قلنا له انت وقعت في جدة, سكانت قصة عجيبة هذي كانت شرارة الريبلادين لمن تواصلنا معاها على جدة كنت له انت وقعت في جدة
انت سويت breach جيت انت ما بتضيف للbrand عندنا ولا شيء لما فتح هو في قطر, انت سوت البريتش جيت انت ما بتضيف للبراند عندنا ولا شي لما فتحوا في قطر
ما كان عنده نوزومي لندن و وقع في الفردان في kempinski في في قطر, ما كان عنده نزوم لندن ووقع في الفردان في كمبينسكي في قطر
مسؤولية ولا شيء مسؤولية ولا لنا income ولا fees ولا شيء تدربوا عندنا موظفين, ولا شي مسئولية ولا لنا income ولا fees ولا شي تدربوا عندنا منظفين
ولا اخذنا منه ولا شيء for the sake of the relation العلاقة لأنه الشراكة هي الشراكة هي شراكة طويلة الأمد فأنت تفكر فيها مع شريكك ماتفكر فيها في خلافات من البداية, ولا أخذنا منه ولا شي for the sake of the relationship الأعلاقة لأن الشراكة هي شراكة طويلة الأمد فأنت تفكر فيها مع شركك ما تفكر فيها في خلافات من البداية
قلنا له هنا كانت هذي في october الفين وسبعطعش,
إيقاف العقد لسبب أسباب الbreach اللي انت قاعد تسويها, لسباب أسباب البريج اللي انتقعد تسويها
اولا نوزومي لندن does not exist فال فالاتفاقية غير مفعلة, أولا نوزومي لندن دازنت إكسست فالاتفاقية غير مفاعلة
طيب ومافيه اي zero support ولا فيه system كل الأشياء اللي تنص عليها الfranchise هذي zero ماهي قاعدة تجي, طيب وما في أي zero support ولا في system كل الأشياء اللي تنص عليها الفرانشايز هذه zero محي قعدة تجي
نص الmenu اللي تشوفه from day one تطويرنا حنا, نص المنى اللي تشوفوا from day one تطويرنا حنا
ok انه لمن نطور أشياء معينة اللي هي الbest sellers اليوم في ميازو واللي كانت في نوزومي هذي تطويرنا احنا ما اخذناها من, okay إنه لما نطور أشياء معينة اللي هي البستسيلر اليوم في ميازه واللي كانت في نزومي هذه تطويرنا إحنا ما أخذناها من
فبس عشان تكون على بينة ok فا, فبس عشان تكون على بينه اوكي ف
على brand جديد,
الbrand جديد هذا يحل محل مس, البراند جديد هذا يحل محل مسؤول
فعينا شركة متخصصة فالbranding, فعيننا شركة متخصصة في البراندنغ
اء كانت متخصصة فالfashion branding بالتحديد وليس فيه مجال المطاعم, كانت متخصصة بالفاشن من هندق بالتحديد وليس في منجم مطاعم
فالfashion branding boutique company very small company boutique مقرها في باريس في فرنسا, في الفاشن براندينج بوتيك كمبني باريس مقارها في فرنسا
سنتين لين ماسوينا full brand اسمه ميازو, سنتين لما سوينا full brand اسمه ميازو
وميازو ما كان rebrand او rename سجلنا ميازو لأنه فيه هدف عندنا وش هي الفكرة اللي عندنا موجودة انه ميازو باذذن الله يطلع فكل, وميازه ما كان ري براند أو رينيم سجلنا ميازه لأنه في هدف عندنا وفي الفكرة اللى عندنا موجودة انه ميازه بإذن الله يطلع في كل
ان شاءالله نطلع وانه يطلع brand سعودي اسمه ميازو, إن شاء الله نطلع وإنه يطلع براند سعودي اسمه ميازو
ل ماكان وقتها محدد الاسم بس انه يطلع brand سعودي يمثل زي ما لأنه, ما كان وقتها محدد الاسم بس انو يطلع براان سعودي يمث ل زي ماك لانو
جاتنا الفكرة اللي هي الثانية انه زي ما احنا قاعدين نجيب من برا franchise, جتنا الفكرة اللي هي الثانية انه كما احنا قادين نجيب مطعم بره فرنش هذي
بحيث أنه يتأكد من اليابان إلى أمريكا عشان حتى ماحد يقول أخذتوا الاسم copy من اليابان الاسم, بحيث انه يتأكد من اليابان الى امريكا عشان حتى ماحد يقوله خدته اسم copy من اليابان الاسم
we launched it في قبل الان ان شاءالله في ديسمبر نكمل ثلاث سنوات فيه ديسمبر عشرين عشرين, we launched it في قبل الآن إن شاء الله في ديسمبر نكمل ثلاث سنوات في ديسمبر 2020
اء سان كارلو شيكتي وقعنا له سان كارلو group اللي تملك سنيور ساسي اسمها سان كارلو group عندهم مجموعة مطاعم, سان كارلو جركتي وقعنا إلهو سان كارلو جرووب اللي تملك سنيور ساسي اسمها سان كارلو جرووب عندهم مجموعة مطاعم
ok بbrands مختلفة هذي سان كارلو group احنا وقعنا مع سان كارلو group, أوكي برانز مختلفة هذي سان كارلو جروب احنا وقعنا مع سان كارلو جروب
اء بين كارلو الowner حق سان كارلو, بين كارلو الأونر حكسان كارلو
أمريكانا فقال حتى لو ما فتحوا بس انا استحي اني اروح اطلبه release, أمريكانا فقال حتى لو ما فتحه بس أنا استحني أروح أطلبه ان يعطيني release
تواصل معانا قال الآن خلاص تقدر تأخذه ال agreement لأنهم يعني مافيه احد, تواصل معنا قال للآن خلاص تقدر أنتأخذ الأجريمنت لأنهم يعني ما فيه أحد
وقال ما لا يمكن أرجع له او اكلمه او ارفع عليه السماعة او احطه تحت pressure, وقال ما رأى لا يمكن ارجعله أو اكلله او ارفع عليه السماعة او احطه تحت pressure
في محل نوزومي حق الcatering, في محل نزومي حق الكاتيرنج
سبحان الله مكتبنا موجود فوق urth cafe اللي فالتحلية, سبحان الله مكتبنا موجود فوق الف كافيلر التحذيه
ok هذا كان حنا مستأجرين المبنى كامل فبالتالي يسهل علينا الإدارة, اوكي هذا يكن حل نستأجر من المبنى كامل فبالتالي يسهل علينا الادارة
شلنا نوزومي catering طب وش نسوي فالموقع ايه, شن نزومي كيترين طب وشنسوي في الموقع
ok ايش نسوي فالموقع الموقع حنا نفتح unclear يا سلام فحطينا فالموقع عساس, ايش نسوي في الموقع الموقع حالا نفتح يا سان فحطينا في الموقع عشان
ماهو بنفس الsegment حقت ميازو ولانوزومي في ذاك الوقت it s a casual كا هذولي الثلاثة, ما هم نفس السيغمنت حقت ميازو ولا نزومي في ذاكل وقت اتسا كاجول هذور الثلاثة 
فال فالgroup وعندك ستة براندات ثانية اللي جت بعدهم خسرانين, في القروب وعندك ستة براندات ثانية اللي جت بعدهم خسرانين
ok يربحون وليش الستة الاخرين قاعدين يخسرون ok طبعا اء, يربحونه ليش الستة الآخرين قاعدين يخسرون أوكي طبعا 
خدم الbrands هذيك بعدين لما جت كورونا, خدم الـ brands هذيك بعدين من جد كورونا
ok هذي ال في عشرين عشرين جت كورونا اخر التسعطعش بس في عشرين عشرين, أوكي هذه الفئة 2020 الجوت كورونا آخر 19 بس في 20 20
ok المالي هذا أثرها المالي نقطة وبعدين يجي المعروض, أوكي المالي هذا أثرها المالي نقطة وبعدين يجي المحروف
انت في سوق حر ماتقدر تجي تقول شركات لا تفتح مطعم وما تقدر تجي تقول تسوي zoning, انت في سوق حر ما تقدر تيجي تقول شركات لا تفتح مطعم وما تقدر تيجي تقول تسوي زوننگ
فالنهاية اقتصاد حر من حقه انه يأخذ تصريح ويفتح مطعم هو صاحب القرار ok فصار فيه معروض ومعروض من القطاع الخاص, في النهاية القصاد حر من حقه انه ياخد تصريح ويفتح مطعم هو صاحب القرار فسار في معروض معروض من قطع الخاص
والdemand جالس يزيد بس بالتدريج, والدمان جالس يزيد بس بالتدريج
طلب حجز في billionaire, طلب حجز في بلينير تدخيل لا ميازه
اء ماعرف سوي جربنا الshow بعدين لقينا comments كثيرة انه الshow, معرفة جربنا الشو بعدين لقينا comments كثيرة انه الشو
اء ممل ومتكرر وقفنا الshow, ممل ومتكرر وقفنا الشو
لمن وقفنا الshow الان تجينا طلبات انه رجعوا الshow, لما نوقفنا الشو الان تجينا الطلبات انه رجعوا الشو
الشركة اللي جايبينها عشان نسوي الshow هي شركة في اسبانيا, الشركة اللي جايبين عشان تسوي الشو هي شركة في اسبانيا
هل المساحة الملمومة والناس سعر لما والسعر ok السعر في شيكتي, هل المساحة الملمومة والناس السعر السعر في جكتتي
فهو يعتبر casual,
