gt,hyp
كنت في course احد الكورسات في في harvard اء اقابل, كنت فيه كورس احد الكورسات في هارفرد أقابل
رواد أعمال عالميين يتابعون endeavor طبعا انا تم اختياري في endeavor في الفين وثمانطعش, رواد أعمال حلمين تبعون أندفر طبعا أنا تم اختياري في اندفر في 2018
اء الأب الروحي للentrepreneur,
تروح في امريكا تحس نفس انت ولا حاجة بالنسبة لهم وفعلا كنت في هال في هالcourse, تروح في أمريكا تحسن انت ولا حاجة بالنسبان وفعلا كنت في هالكورس
اغلب ال يعني اء لما يبدأ يعطي history اني, اغلب الا ايضا يعني لما يبدأ عطوا هستوريني
وش how much your raise انا الseries a كان اربعة مليون دولار, وش هوموتش يورايز أنا السيريس اي كان 4 مليون دولار
بعدين series b مثلا كان قبل ما انا اسوي raise seriesb بس عندهم كان الseries a, عندهم series b مثلا كان قبل ما أنا أسوي لي series b بس عندهم كان series a
اليوم صار فيه تضخم اليوم نشوف واحد يجمع seed, اليوم صار في التضخم اليوم نشوف واحد يجي مع سيد
seed round على خمسين مليون دولار في في أمريكا يعني ممكن بشكل سريع بما انك جبت طاري هذي الأشياء للي ما يفهم هذي المصطلحات, seed round على خمسين مليون دولار في أمريكا طيب ممكن بشكل سريع بابانك تجلب طالية هذا الأشياء لللي ما يفهم هذه المصطلحات
ايش يعني series seed round ولا series a ولا series b , ماذا يعني series seed round ولا series a ولا series b 
فيه seed round هو اول هو فيه ترا pre seed, فيسيد راوند هو اول هو فيه ترى preseed
أول شيء ما قبل البذرة ما قبل البذرة وعادة تأخذ الفلوس من friends and family اهل وأصدقاء الاهل وأصدقاء حلو فيه الseed, اول شي في pre seat وما قبل البذرة وعادة تاخذ الفلوس من friends and family الاهل واصدقاء الاهل واصدقاء حلو في seat
الseed غالبا أهل وأصدقاء وangel investors يدخلوا فيه المستثمرين الجريئين, السيد غالبا برضه أهل الصدقاء وإنجيل انفسترز يدخلوا في المستثمرين الجريئين
حلو الملائكيين يسمون ايه بعدين الcsa هو مرحلة النمو, ملاعكين يسمونه بعدين csa هو مرحلة النمو
يعني انت المفترض انه فالseed انت من الseed الى الa, يعني انت المفهوم مفترض انه في السيد انت من السيد إلى الاي
انت اثبت وجود mvb الفكرة حقتك والتركيز a النمو, انت أثبت وجود mvp الفكر حكتك والتركيز أي النمو 
تستخدم فلوس عشان تبدأ توسع ايه تبدأ توسع تبدأ تنطلق جغرافي حلو b تبدأ مفروض انه extension للa, تستخدم الفلوس عشان تبدأ توسع ايه تبدأ توسع وتنطلق جغرافيا بي تبدأ مفروض انه extension للـ a
والb يكون عادة اء اء توسع لازم الg يبدأ الg care, والبي يكون عادة التوسع لازم الجي يبدأ الجي كيف
فأنت تتطلع انها تتوسع مو بس جغرافي حتى فالrbo, فأنت تطلع أنه تتوسع م و بس جغرافي حتى في الاربو
فالaverage per per user فال تضيف منتجات إضافية and so, فالاديرج driven per user تضيف منتجات إضافية
طبعا c عادة c و d, طبعا c عادة c و d
يكون pre exit او pre acquisition او pre ما قبل التخ ماقبل التخارج ايه او الطرح ممتاز هذا تعريف سريع عالجولات انت, يكون pre exit او pre acquisition او pre قبل التخارج ايه اول طرح كنت هذا تعرف سريع الجولات انت
قفلت ال ال الجولة حقت الc الان لا قبل ايه انت قفلت a, قفلت الجولة حقا c الآن لا قبل هاتك قفلت a
وكانت هدفها النمو yes و وبعدين تكلمنا على موضوع svc وتأثيرها الفين وثمانطعش, وكانت هدفها النمو وبعد نتكلمنا على موضوع sbc وتأثيرها 2018
الف وسبع مية مية الف وسبع مية sorry الفين والفين وثمانطعش ايه النمو صار two x unclear يعني حنا ننمو, النمو صار 2x year of read يعني احنا ننمو
عدد المطاعم و من عاد الش الmrr طبعا احنا كا, لعد المطاعم ومن عاد الأمرار طبعا احنا كـ
باء في covid في عشرين عشرين فعشرين عشرين كم كان حجمها عشرين مليون دولار تقريبا عشرين مليون دولار, في كوفيد في 2020 في 2020 كم كان حجمها 20 مليون دولار تقريبا 
بقيادة رائد بقيادة رائد عفوا لا بقيادة سنابل سنابل وstv, بقيادة رائد بقيادة رائد أعفوا لا بقيادة سنابل سنابل اس تيفي
سنا سنابل و سنابل وstv في series b ok طبعا هي لها قصة انه, سنابل استيفي سيريس بي طبعا هي لها قصة يعني انه
اء اللي هي كيف بدأت الround انه, اللي هي كيف بدأت الـround إنه
يعني انا برضو وصلت لمرحلة ان ما عندي احد يعطيني term sheet ويسعر تقييم الشركة الا شخص شركة وحدة بس, انا برضه وصلت لمرحلة ان ما عندي احد يعطيني term sheets او يسعر تقييم شركة الا شخص شركة واحدة بس
اسمها stv ايه ماكانت كل الصناديق الثانية ماعاد تعطي ماتعطينا شركة اكبر صارت من اللازم, اسمه stv ما كانت سناغل ما تعطينا الشركة أكبر صارت من اللازم
و و bridgesعادة تعطي اء bridge, وبرجز عادة تعطي آآ برج
i m pitching و بس كيف الفكرة اني, مبتشينج هي بس كيف الفكر اني
اني قبل ال هذا كنت اتواصل مع جماعة process اللي هو naspersاسمهم سابقا, اني قبل الهذا كنت اتواصل مع جماعة بروسس اللبه هو ناسبرس اسمهم سابقا
قالوا لي احمد احنا مبسوطين نبا نعطيك الterm sheet ولكن من شروطنا, بالله أحمد احنا مبسوطين وبنبي نعطيك التربشيت ولكن من شروطنا
ونقابل physically الفريق الفريق والfounders تحديدا, ونقابل physically الفريغ والfounders تحديدا
فجاة سمعوا قالوا انه الteam هون ما قدر يجي دبي لأنه سمعنا انه فيه covid, افجأة سمعوا قالوا انو تيم هون ما قدر يجي دبي لانا سمعنا انو في كوفيد
cases في دبي فاحنا مانقدر نجي قلت له طيب انا أجيك السعودية مافيها covid, cases في دبي فاحنا ما نقدر نجي قلتوا طيب أنا أجيك السعودية ما فيها كوبا
و وقت بدت فعلا العالم يطلع فعلا فيه covid, ووقت كارول بدأت فعلا العالم يطلع فعلا في كوفيد
والناس كلهم فال فالرياض يقولون يرجعون اهلي يقولون ارجع ترا بيقف الموضوع serious أقول ايش سي ماهو موضوع وفعلا وقتها كان فيه, والناس كلهم في الرياض يقولوا ارجعون وانه يقول ارجع ترا بيقف الموضوع serious اقول ليش سيرس ما هو موضوع وفعل ا وقته كان فيه
هنا عرفت ان الموضوع serious همم ونفس ال الجماعة هونوا يعني قالوا, هنا عرفت ان موضوع series ونفس الجماعة هونوا يعني قالوا
رحت عن طريق نيويورك عشان أمن نفسي اني ادخل السعودية وخلاص فالوضع كان serious, روحت عن ضريق نيويورك عشان أمن نفس اني ادخل للسعودية وخلاص فالوضع كان سيريز
ما كان عندك الا stv ما عندي الا stv وفجأة طلعت لي سنابل سنابل توها تبدأ تتحرك توها تبدأ تتحرك وقتها, ما كان عندك الاستيفي ما عندي الاستيفي وفجأة طلعت لي سنها توا تبدأ الحراك في هاتا
أتوقع كان اول transaction احنا سواه معانا اء وبدينا نشتغل معاهم والحمدلله انه, كان اول transaction احنا سواه معانا وبدين نشتغل معهم والحمد لله انه
هنا ال انا دائما احب انه من تجربتي السابقة فال fundraising انه to create competition, هنا أنا دام ا أحب إنه من تجربة السابقة في الفاندريزن إنه ت create competition
على الticket فتقول انت تب انت عارض مثلا عشرة مليون, فتقول أنت عارض مثلا 10 مليون
الoversubscription هو اللي ارتفع الى عشرين فتعرض عشرة, الـ oversubscription هو اللي ارتفع على عشرين فتعرض عشرة
من ال اء يعني مستثمرين وتبدأ تختار انت منهم وتبدأ تأخذ الterms وال evaluation اللي انت يناسبك, من المستثمرين وتبدأ تختارنت منهم وتبدأ تاخد terms والvaluation اللي انت تمنع ناسبك
وقتها الdelivery hero عطونا off term sheet, وقت هات دليفري هي رو عاطوني أثر ترمشيت
والdelivery hero شركة كبيرة اء وتقييم عطونا تقييم حلو, ودليفير هيرو شركة كبيرة وتقييم حلو
فا عرضت الterm sheet الى, فعرضت تلمشيت الى
سنابل وسنابل they really match, سنابل وسنابل لي متشل
الevaluation و وهنا هنا هنا شط هنا قوة الشركة , واو وهنا القوة الشركة
فقفلتوا الround في وقت covid في وقت covid april كان ولا تقريبا ايه yeah almost تقريبا وقتها الevaluation كم صار , فقفلت الراوند فيه وقت كوفيد في وقت كوفيد ايبريل كان او لا تقريبا ايه يا almost تقريبا فيه وقت هالفالواشن كم صار 
حدود ال وقتها مية مية مية مليون مية مليون دولار yes yes, حدود الوقتها 100 مليون دولار 100 مليون دولار
اعلى شوي وبعدها صار فيه تطويرات على موضوع المنتج صح بعد الجولة هذي yes yes بديتوا تدخلون في fintech, وبعدها صار فيه تطويرات على موضوع المنتج صح بعد الجولة هذي بديتم تدخلون في الفينتك
طبعا هدف foodics بديت يعني كنت we are pinching mark خلنا نقول with square, طبعا هدف فودكس بدأت يعني كنت we are benching mark هنقول with square
فأمريكا square تقارنون نفسكم فsquare square payment وهنا اسمع انا انه صعب, فيامريكا سكوير سكوير وسكوير بايمنت وهنا اسمع انه صعب
تأخذ رخصة من sama والموضوع ماهو سهل فا قلت ويأخذ الprocess سنة, تاخذ رخصة من ساما والموضوع ما هو سهل فقلت ويأخذ الـ process سنة
ناديت فريق الproduct عندي قلت يا ابا واحد منكم سلمته المهمة, نديت الفريق الـ product عندي قلت يا أبا واحد منكم سلمته المهمة
ي يمسك ملف sama و sama ويقدم على الرخصة على أمل انه السنة الجاية نأخذها, يمسك ملف انتنتك وسامة ويقدم على الرخصة على أمل ان السنة الجاي ناخدها
بعد كذا ثلاث أسابيع دخل قال مبروك يا احمد عندنا اجتماع مع sama قلت له وش, بعد كده ثلاثة سابيع دخل قال مبروك احمد عندنا نجتمع مع ساما ولفصلوا وش 
sama و تغير, سامة وتغير
فعلا وهنا الفين وثلاث الفين وتسع طعش هو من يوم اطلاق الsand boxing, فعلا وهنا 2019 هو من يوم إطلاق الساند بوكسنج
ودخلنا الsand box طبعا رحنا عرضنا الحمد لله, ودخلنا السانبوكس طبعا رح نعرضنا الحمد لله
وقتها انا قفلت كل مشاريعي وكل أولوياتي وأول أولوية اني اتعلم اتعلم وش هو الfintech, وقتها أنا قفل كل مشاريعي كل أولوياتي وأول أولوية أن يتعل م هتعل م وش هو الفنتك 
اتعلم ايش الpayment اتعلم وش ال البنوك الbanking system بديت اعين مستشارين اتكلم, أتعلم مش البنوك البانكنج سيستم بدأت أعين مستشارين أتكلم
وفعلا الحمدلله دخلنا الsand box و في عشرين عشرين, وفعل الحمد للله دخلنا الساندبوكس وفي 2020
اء مع في منتصف الجائحة اء البنك المركزي عطانا الgreen light انه روح, في منتصف الجائحة البنك المركزي عطانا ال green light أنه روح
دوسوا وزعوا الpoint of sale كان فيه initiatives انه to, دوسوا وزعوا الـ point of steel كان فيه initiatives انه تو
يمنعوا الcash cashlees وتركز على, يمنعوا الكاش ويتركز على الـ
على الpayment والحمدلله هذي فرصة كانت حلوة اخذناها للاستحواذ على العملاء, على الpayment والحمد لله هذه فرصة كانت حلوة أخذناها لاستحواذ على عملك
فا فهذي دخلت ال ضمن الfoodics نعم اللي هي foodics pay نسميها الان, فهذه دخلت الضمن الان فودكس نعم اللي هي فودكس بين سميها الان
foodis pay foodics pay foodics pay yes اللي هي يعني كيف طريقتها ok, foodexpay yes اللي هي يعني كيف طريقتها أوكي
foodics الأساسي هو نظام الcasher نظام المطع المطعم ال مستودع وذا yeah فيه ااء, فودكس الاساسي والنظام الكاشين نظام المطعم من يو من يو في تودع في
ال ال الplan فالroad map أنه ندخل في foodics pay نصير نقدم, الـ plan في الroadmap اللي ندخل في foodxpay انسير نقدم
اء للعميل يصير خلاص one shop stop انه العميل يأخذ الpoint of sale ويأخذ, للعميل يصير خلاص وان شوب ستاب انه العميل ياخذ الpoint of sale وياخذ
اء اء نقاط البيع من عندنا اللي هو المدفوعات الرقمية وبعدين يأخذ قروض عن طريق foodics capital, نقاط البيع من عندنا اللي هو المدفوعات الرقمية وبعدين ياخذ قروض عن طريقة فودكس كابيتل
عنده foodics online يستقبل طلبات online ومع التوصيل وكل شيء فهذا هو كان الطموح من البداية, عنده فودكس أونلاين يستقبل طلباته أونلاين مع التوصيل وكل شيء فهذا هو كان الطموح من البداية
عشرين عشرين جاء covid وما شاء الله جاء covid سويناها كلها فيوم سنة وحدة ما شاء الله ايه اليوم تقرضون عملاء نعم بدينا عندكم ترخيص انكم تقرضون لا حنا نشتغل مع اء مع, 2020 شاكويد وماشاء الله سوا ناكلها في يوم واحدة ماشاء الله اليوم تقرضون عمر الحديد نعم بدينه عندكم تركيص انكم تقرضون لا حننشتغل مع مع
ونقرض up to خمسة مليون ريال يعني عن طريق بعض الشركاء و و برضو بدأتوا توسعون يعني انت كنت تقول, ونقدر ابتو خمسة مليون ريال يعني عن طريق بعض الشركة برضه بدأتوا توسعون يعني كنت تقول
في مقابلة عام الفين و واحد وعشرين انه foodics انطلقت من الخبر الى واحد وعشرين دولة حول العالم صحيح اليوم كم دولة انتم, في مقابل عام 2021 إنه فودكس انطلقت من الخبر إلى 21 دولة حول العالم صحي اليوم كم دولة أنتم 
اليوم حنا ترا حول الأربعين دولة أربعين دولة فالعالم foodics ايه foodics نعم واكثر من سبعة لغات مش لغة وحدة فرنسية, اليوم حول الاربعين دولة في العالم اربعين دولة في العالم فودكس ايه فودكس نعم واكثر من سبع لغات مش لغة واحدة فرنسية
امارات ومصر امارات ومصر اء طبعا بعد موضوع ال ال ال الfintech, طبعا بعد موضوع fintech
اء يعني الأمور شوية تغيرت كا كا evaluation وكا potential بالضبط بالضبط فدخلتوا انتوا في موضوع الجولة الأخيرة هذي نعم, يعني الامور شوية تغيرت كـ valuation وك potential ببط فدخلتوا انتم في موضوع الجولة الأخيرة هذة
اء وش اهم اللي حيختلف في foodics بعد هذي الجولة, ووش أهم اللي حيختلف في فودكس بعد هذا الجولة 
طبعا اء foodics pay الأساس هو ما هو بال بالنموذج اليوم قريبا ان شاء الله, طبع ا foodxpay هو مهو بالنموذج اليوم قريب ا إن شاء الله
حنعلن عن يعني الصورة الحقيقية لfoodics pay, هنعلن عن صورة الحقيقية لـ foodics pay
اللي هي ال soft pos فيصير نفس الtablet, فيصير نفس التابلت
الcasher لfoodics هو يقبل الدفع فأنت ما يحتاج عندك أجهزة أخرى ثانية, الكاشير لفودكس هو يقبل الدفع متى ما يحتاج عندك اجهزة اخرى ثانية
على أساس تقبل الدفع وعملية الربط والintegrations وال ال rela ما يكون يعني , على أساس تقبل الدفع وعملة الربط والانتغريشنز والريلا ما يكون يعني
فيه عندنا مدفوعات عالطاولة table payment انت تروح المطعم, في عندنا مدفوعات على الطاولة table payment أنت تروح للمطعم
تجلس فالمطعم تبغى تدفع فاتورتك فيه qr code تنسخه تلاقي فاتورتك نفسها تدفعها, تجلس في المطعم ده بتدفع فاتورتك في qr code تنسى خود لاجي فاتورتك نفسها تدفعها 
بدل مايجي الwaiter بدل مايجي الwaiter تدفع وتمشي please excuse me عطني وجه مرة, بدون ما يجي الويتر بدون ما أنا صرحت please excuse me أقد واج مرة
يعني يعني يستفزني الwaiter اللي ما يكون منتبه ايه صح فتقعد, يعني يستفزني الويتر اللي ما يكون منتبة أيسا فتقعد
ان الwaiter نفسه, إن الويتر نفسه
هذا رقم اثنين هذا رقم اثنين رقم ثلاثة ان نفس الد نفس الapplication, هاد رقم اثنين رقم ثناثة إن نفس الـ application
الcasher مع الcostumer display العرض وانت فال booking, اه الكاشير مع الكستمر ديسبلي العارض اللي وانت في الوكن
costumer تقدر تدفع من الtablet نفسه بدون اعتمادية على اي جهاز اخر, تقدر تدفع من التابلت نفسه بدون اعتمادية على أي جهاز آخر
ال ال الdrive through and الkiosk فالآن foodics تقدم kiosk, الدرايف ثرو و الكيوسك فالآن فوديكس تقدم كيوسك
اء في اي مطعم فيه kiosk كامل في نفس الkiosk تقدر تدفع, في اي مطعم في كيوس كامل في نفس الكيوس تقدر تدفع
تمر فالdrive through اء اخذت الطلب من الdrive through تطلع جوالك, تمر في drive thru أخذت الطلب من drive thru تطلع جوالك
ت scan qr code وتدفع, تدفع
كل يعني هذي hardware ذي بتصير ولا هذي كلها hardware و payment طبعا احنا الخدمة الج كل خدماتنا القادمة اليوم, هذي هاردوير دي بتصير هذي كلها هاردوير وبهيمة طبعا احنا الخدمات القادمة اليوم
احنا راح نصنع our own hardware, إحنا راح نصنع our own hardware
انه to control الexperience من a to z, انو تكونترول الاكسبرينز من اي تو زد
فأحنا مهتمين من الhardware, فاحنا مهتمين من الهاردوير
ومهتمين فالsoftware المشكلة انه لقينا من تجربتنا السابقة فيه, وامهتمين في الصوفتور المشكلة أنه لقيانا من تجربات السابقة أنه في
اء انطباع سيء يأخذه العميل مو بسببنا بسبب والله limitation موجودة عالhardware, انطباع سيء ياخذ العميل ليس بسببنا بسبب والله limitation موجود على الهاردوير
almost خمسة وعشرين الف خمسة وعشرين الف عميل همم بكامل بياناتهم موجودة عندكم صح ايش, نعم almost 25000 25000 عميل بكامل بياناتهم موجودين عندكم إيش 
ايش ممكن نطلع بtrends أو أو ملاحظات أو تحليل لهالبيانات تقدر تهديه, ايش ممكن نطلع بترندز او او ملاحظات او تحليل لهالبيانات تقدر تهديه
لتطوير منتجات foodics, لتطوير منتجات فودكس
ماهي اء خلنا نقول garbage in garbage out هذي دايما أقوله فأي نظام موجود, ما هي خنا نقول garbage in garbage out هذا داما أقوله أن في أي نظام موجود
تعطيه بيانات اء يعني غير صحيحة يعطيك outcome غير صحيح, تعطي بيانات غير صحيح هاي يعطيك outcome غير صحيح
انا ودي والان بدينا بمرحلة والمرحلة تطوير هذي تحتاج وقت طويل ما machine learning يبغى لها وقت طويل, أنا ودي والآن بدأنا المرحلة لمرحلة التطوير هذه تحتاج وقت طويل ماهي يبغى لها وقت طويل
فأحنا اليوم في مرحلة اء business intelligence phase, فاحن اليوم في مرحلة business intelligence phase
اء نعرف وش أولويات وش الpains اللي موجودة عشان نبدأ, نعرف وش أولويات وش ال pains اللي موجودة عشان نبدأ
نسلط الضوء عليها ونطورها فلسا مافيه الان اي trends معين انتم شايفينها فالفترة الماضية, نصلط الضوء عليه ونتطورها فلسة ما فيه الآن أي ترنز معين انت شايفينها في الفترة الماضية 
ال الback end وال wastege اللي قاعد يصير فاليوم اك نكتشف وموجودين وشايفين فالبيانات انه, الباك اند والويستيج اللي قاعد يصير فاليوم نكتشف وموجودين ونشايفين في البيانات إنه
فيه اء wastege هدر وهدر, في ويستج وحدر
و fraud بعد وين في الback end فالinfantry فالجرد اه فالمخزون, وفرود بعد اين في ال back end في ال inventory في الجرد المتزون في المتزون
فالback end فالbo عمليات المشتريات, في الback end في البي او عمليات المشتريات
نقدم خدمة الsuppliers نو اء, نقدم خدمة الـ
اء يعني نعطي الsupplier المواد مواد ال ال, يعني نعطي المواد
المطعم لي المطعم direct عن طريق foodics supply نسميه, المطعم ديركت عن طريق الفودكس سبلايا تسميه
فيه برضو بيانات اء الmenu engineering يعني اليوم, في برضو بيانات المنيو انجينيري يعني اليوم
يعني عندها اء يعني معلومات في الmenu, يعني عندها معلومات في المينو
