gt,hyp
قلت لي إصابة padel أجل yeah, قلت لي صابة بهذا الاجل
وش علاقتك مع الرياضة أشوفك تلعب تنس مع الأمير عبدالعزيز الفيصل رئيس اتحاد الغولف والحين padel وش قصتك مع الرياضة, وش علاقتك مع الرياضة اشوفك تلعب تنس مع لميل عديز الفيصل واستحاد القولف والحين بادل وش قصتك مع الرياضة
كان فيه الصالات اللي موجودة وجايبين معاهم اعتقد united states sports academy مدربين في كل أنواع الرياضة, كان في الصلاة الموجودة وجايبين معاهم أعتقد يونيت ستيت سبورتز اكاديمي مدربين في كل أنواع الرياضة
انا was fortunate enough محظوظ جدا انه كان عندنا access للوالد كان ضابط متقاعد, أنا وز فورتينيث ناف يعني محظوظ جدا انه كان عندنا اكساس لان الوارد كان ضابط من القائد
ندور لهم على sports مافيها يعني أقل احتكاك جسدي او يعني مافيه إصابات وذا, ندور لهم على سبورتس مافيها يعني اقل احتكاك جسدي أو يعني مافيه اصاباتو ذا
وبدينا من هناك بديت معاهم اروح معاهم كل weekend وذا, بدأنا من هناك بدأت معهم اروح معهم كل weekend وذا
إعاقة او handicap,
فكيف تقدر كل مرة تفوز على نفسك او على الإعاقة حقتك او الhandicap حقك, فكيف تقدر كل مرة تفوز على نفسك أو على الإعاقة حقك أو الhandicap حقي 
الجديدة القديمة نسبيا ايه هل لسا تلاقي وقت للرياضة yeah, هل لست تلاقي وقت للرياضة 
اذا احد اتصل علي ok تعال خلن نجلس نتقابل فا its, إذا حد تصل عليه أوك تعال خلني نجس نتقابل فـ
its part of my life الان والعائلة هذا أفضل ما في الموضوع انهم متفهمين ومقدرين الكلام هذا, part of my life الآن والآلة هذا أثر ما في الموضوع إنهم متفهمين ومقدرين الكلام هذا
ال حتى الsocial activities اللي تكون موجودة العائلة يكونوا معي, حتى ال social activities اللي تكون موجودة العائلة يكونوا معي
فيها ويكون فيها business فا يعني صار جزء من نمط الحياة ايه صار جزء من اء أصلا لو ما سويت شيء زي كذا احس انه فيه, فيها ويكون فيها business فيعني صارت جزء من نمط الحياة اصلا لو ما سوا شيئ زي كذا حسنه في
صحيح فيه شيء ناقص فا its part of it حنا أبو فيصل سعداء نستضيفك بصفتك المحافظ لصندوق الاستثمارات العامة, صحيح في سين اغس حنبو فيصل سعدان اسطيفك بصفتك المحافظ لصندق صمارات العامة
denmo denmo الحراك حق التحول الاقتصادي فالسعودية من الفين وخمس طعش إلى اليوم, الدينامو الحراك حق التحول الاقتصادية في السعودية من 2015 إلى اليوم
اء كنت الرئيس التنفيذي للسعودي الفرنسي capital وقبلها كنت, كنت رئيس تنفيذي للسعود الفرنسي capital وقبلها كنت
رحت للديوان and it wasnt للصندوق الاستثمارات العامة, رحت للديوان متوازنت للسندق الاستمارات الأهمة
i was brought in على شان التأسيس مركز اتخاذ دعم القرار, i was brought in علشان تأسيس مركز إتخاذ دعم القرار
كانت فكرة سمو الأمير انه معظم القرارات اللي تكون موجودة based على الopinion على الرأي, كانت فكرة سمو الأمير ان معظم القرارات اللي تكون موجودة باست على الاوبنين على الرأي
وليست based على الأدلة او الevidence, وليست based على الادلة او ال evidence
فا عطانا الرؤية حقته وسألته يعني انا ما ما اشتغلت ايش علاقة banker في مركز دعم اتخاذ القرار فقال لأنه الbankers, فاعطاني الرؤية حقته وسألت يعني انا ما شغلت في الشايزة باش علاقة بانكر في مركز دامس خذقرا فقال اللي انه البانكريز
ما يستخدموا فقط الرأي انه my gut feeling انه to go and buy this ولا سوا كذا, ما يستخدم فقط الرائي مايكت فيلن انو تو جوا ونبيع دس ولد سوي كبه
السعودي الفرنسي capital معروف يعني كان الأول ما أحد يعرفه, السعود الفرنسي capital معروف يعني كان الاول ما حد يعرفه
وسوينا فيها كمان يعني الdeals, وسوانا في كمان يعني deals
فا كنا access نعطي access للclients حقينا, فكنا access نعطي access للclient s حقين
لأنه يدخلوا مثلا مع black rock مع كل ال اء, لانه يدخلوا مثلا مع بلاك راك مع كل
كان بالنسبة ibos قبلها ال كان سوق الأسهم, كان بالنسبة للآي بيواز قبلها الـ cancels
الظاهر سبعين شركة يوم طلعت كان مية وأربعين شركة so double dub القيمة السوقية كمان كبرت, 71 شركة يوم طلعت كان 140 شركة saw double dub القيمة السوقية كمان كبرت
كنت كمان المسؤول عن الmna activities اللي هي الاندماج و الاستحواذ الاستحواذ كنت مسؤول عن, كنت كمان مسؤول عن الـ m a activities اللي هي الاندماج والاستحواذ كنت مسؤول عن
يعني زي ال reits اللي هي الصناديق العقارية كانت معي كان معي برضو, يعني زي الريتس اللي هي السنديق العقارية كان معي برضه
اء ال accessibility للمستثمرين الأجانب فالسوق السعودي, الاجساسوبليتي للمستثمرين الأجانب في السوق السعودي
اء يعني كان بالنسبة للsystems وكيف تسويها او الprocesses ومن الكلام ذا, إن كان بالنسبة للsystems وكيف تسويها والprocesses ومن الكلام ده
so بعد شهر من بداياتي مع ال مع الديوان,
لكن وفالقروض وفي أشياء كثيرة من النواحي التنموية وليست كا sovereign wealth fund, لكن في القروض وفي اشياء كثيرة من النواحي التنموية وليست كـ sovereign wealth fund
فقلت له ok تكلمت مع اء هيئة السوق المالية قلت لهم عطوني ال اء أسماء, فقلت له اوكي تكلمت مع هيئة السوق المارية قلت لهم يعطوني الاسماء
وجبت يعني جبت الأسماء كاملة والملفات and everything, وجبت يعني جبت الأسماء كاملو والملفات and everything
و i was going through the names يعني و name by name فا ما كان مقتنع بشكل كامل بمعظم الأسماء قال لا جيب لي أحد ثاني, i was going through the names يعني name by name فما كان مقتنع بشكل كامل بمعظم الأسماء قال لا أجيب لي أحد ثاني
and we were going through everything وش كان وش كان محتوى هذاك الاجتماع ال اء المحتوى حطينا يعني الblueprint, وش كان محتوى ذاك الاجتماعي المحتوى حطينا البلوبرينت
الان اء وش كانت رؤيته في ذيك اللحظة حنا نتكلم على الفين وخمسطعش لسى قبل ما الناس تدري عن الصندوق الفين وخمسطعش again سمو الأمير اعتمد على معلومات اكثر من رأي, وش كانت رؤيته في ذيك اللحظة هلنتكلم عن 2015 لست قبل ما الناس تديعن الصدور اه في 2015 again سمو الأمير يعتمد على المعلومات أكثر من الرأي
so اول شيء سويناه, أول شيء سونا
فحص كامل diagnostic, فحص كامل diagnostic
ايش هي الpros الcons الأشياء اللي نسويها الأشياء اللي ما نسويها هذا رقم واحد, ايشي البروز القونس الاشياء اللي نسويها الاشياء المنسويها هذا رقم واحد
رقم اثنين benchmark, راكم الثاني بنشمارك
الsovereign wealth funds فالعالم يسوونه, الصفران والفونز في العالم يسوون
so اول صندوق sovereign wealth funds فالعالم كان صندوق ال ال اللي هو الكويت, اول صندوق سورن وظفا في العالم كان صندوق اللي هو الكويت
norges bankالأقدم الكويتي الاقدم الكويتي مثل ال norges bank الاستراتيجية حقته, الأقدمة الكويتي الأقدمة الكويتي مثلا النورجس بانك الاستراتيجية حقته
صندوق واحد passive invisment ايش يعني passive يعني يجي يشتري يقول ابغى خمسة بالمية من الpublic market اللي موجودة فالعالم, يش يعني passive يعني يجي يشتري يقول ابغى 5 من الـ public markets اللي موجودة فالعالم
لقينا انه ال اء المملكة او sovereign wealth funds بحاجة الى at least six pools of investments, فلقنا أن المملكة أو sovereign wealth fund بحاجة إلى at least six pools of investments
نبغى اول شيء saudi equity اللي هو نملكه الان يعني في الفين وخمس طعش, نبغى اول شي الـ equity اللي هو نمرك الآن يعني في 2015
هذا one pool,
second pool is sectors اللي كانت موجودة فالمملكة كثير منها either غير موجودة او dormant, الساكند بول is sectors اللي كانت موجودة في المملكة كثير منها ايدر غير موجودة او دورمنت
او انها تعبانه either تعبانه لانه مافيه, أو إنها تعبانة أيضا تعبانة لأنه ما في
استثمار كامل او regulations ضد تطوير الsectors هذي او ما فيه regulations من الأساس تسمح بالدخول فيها excactly, استثمار كامل او regulations ضد تطوير السكتورز هذه او ما في regulations من الاساس للسكتورز تسمح بندخول فيها exactly
الpool الثالث اللي هو الطابع العقاري giga projects, الـpool الثالث اللي هو اللوع الطابع العقاري giga projects
موجود ففكره neom موجود القدية موجود الred sea موجود roshen موجود كل الأشياء هذا فالفكر اللي موجود عنده والرؤية اللي موجودة عنده, موجود فكره نيوم موجود القدية موجود الرجسي موجود روشن موجود كل أشياء هذا في الفكر اللي موجود عنده والروئي اللي موجودة عنده
فا سويناها محفظة او pool, فسوناها محفظة أو pool
مشاريع الكبرى مشاريع الكبرى giga projects حتى الاسم giga يعني قلنا أول شيء mega ايه mega موجودة فكل مكان أي مشروع كبير, مشاريع الكبرى شهرية الكبرى حتى الاسم غيجا موجودة في كل مكان أي مشروع كبير
يسمونه mega projects,
it s not this is giga this is like an eco system كامل, it s not this is giga this is like an ecosystem
الشيء الثالث اللي هو الreal estate والinfastructure, شيء الثالث اللي هو الريل السيت والانفرستوركتشر
بين الsector development وبين على حسب ايش ال ال يعني هذا من الأشياء اللي تم النظر فيها داخليا وين تكون المشاريع مثلا في هذا الpool ولا هذا الpool, بين الـ sector development وبين على حسب يعني هذ من الأشياء اللي تم النظر فيها داخليا وين تكون المشاريع مثلا في هذا البور ولا هذا البور
فهذي الأربعة first أربع محافظ, فهذه الأربعة محافظ
والاستثمار الدولي الأول ما كان عندنا تقريبا اقل من خمسة فالمية less than one and a half percent, والاستثمار الدولي الاول ما كان عندنا تقريبا أقرى 5 أقرى 1 5 
وكان اكثره politicly incentives investment مثلا في الدول العربية في من الكلام هذا فما كانت, وكان أكثر politically incentivized investments مثلا في الدول العربية في من الكلام هذا فما كانت
فا كان فيه عندنا يمكن استثمار واحد اللي هو في posco steel korea في كوريا كان في اخر, كان في عندني ممكن استثمار واحد اللي هو في بوستكو ستيل في كوريا كان في آخر
الاستثمارات الدولية سوينا برضو محفظتين اللي هي الbalanced portfolio اللي هو يستثمر في كل شيء, الاستثمارات الدولية سوينه برضه محفظتين اللي هي balanced portfolio اللي هو يستثمر في كل شيء
ان كان مع الfund managers, ان كان مع الفند managers
ان كان في different underlying فالprivate equity فالpublic markets في فيdifferent instruments of الinvestmets, كان في different underlying في الprivate equity في البublic markets في different instruments أو في الinvestments
هذي اغلبها استثمارات غير مباشرة هذي عبر مدراء صناديق لا حتى مم ممكن تكون direct بس ماهي stratigec, هذه أغلبها استثمارات غير مباشرة عبر السوق عبر المدرسة نادي لا حيثه ممكن تكون direct بس ما هي strategic
stratigec invesment اللي هيdirect, strategic investments اللي هي direct
او non direct بس تكون لها طابع استراتيجي مثل زي مثلا soft bank vision fund that s a strategic يعني forty five billion dollars, or non direct but it s a strategy مثل like the soft bank vision fund that s strategic 45 billion dollars
في صندوق قيمته مئة مليار soft bank نفسهم كانوا حاطين ثمانية وعشرين مليار فيه, في صندوق قيمته 100 مليار softbank نفسه كانوا حاطين 28 مليار فيه
blackstone استثمرنا فالبنية التحتية في أمريكا, black stone استثمرنا في البلد التحتية في أمريكا
خمسين مليار واحنا حاطين عشرين مليار so it s forty percent of that fund so هذي تعتبر strategic استثمارنا اللي وضعنا, خمسين مليار وحنا حاطين 20 مليار so it s 40 of that fund so هاذا تعتبر strategic استثمارنا اللي وضعنا
على الخارطة العالمية للاستثمار في uber,
اء ما داومت فيه tell you the truth لأنه تم نقل صندوق الاستثمارات العامة من تحت وزارة المالية إلى, ما داومت في tell you the truth لان تم نقل الصندوق الاستمرار العام من تحت وزارة المالية الى
so سمو الأمير قال go and find proper offices لكم , سمول امير قال go and find proper offices like them
and رحت هناك كانت تقريبا ماهي جاهزة المدينة الرقمية, and رحت هناك كانت تقريبا ما هي جاهزة المدينة الرغمية
فيه عمارة وحدة فيها اللي جاهزة اللي هي العمارة حقت الmaintanance الصيانة, في عمارة واحدة فيها اللي جاهزة اللي هي العمارة حق المينتنس الصيانة
فقلت ممتاز ok let s take, فقلت متاز okay let s take
يعني جزء منها فا خذينا i remmeber نص دور, يعني جزء منها فاخذانا i remember نص دور
اء region, region
اء was moving out من هيئة السوق المالية وأنا كان يشتغل معي فهيئة السوق المالية, was moving out من هيئة السوق المالية وانا كان يشتغل معي في هيئة السوق المالية
here is what i want هذا ال mandate اللي عندي , here s what i want هذا الماندية اللي عندي
ودي إني ودي إنك تجي قال ok خلاص جاي, ودي إنك تيجي قال لي أوك خلاص جاي
طيب ما سألتني وش الراتب وش هذي قالي خلاص مو مشكلة جاي فكان من أول الأشخاص تركي النويصر samething كان جايني, طب ما سألتني واش الراتق واش راتق قال لي خلاص مشكلة جاي فكان من اول اشخاص تركي النويستر same thing كان جايني
mandate من سمو الأمير انه نبغى نستثمر اء في فرنسا, من سمو الأمير انه انا بغى نستثمر في فرنسا
فا تكلمت مع الprevious employer حقي السعودي الفرنسي capital وتركي كان رئيس الاستثمار هناك ال إدارة الأصول, فتكلمت مع الـ previous employer حقي السعودي الفرنسي كابيتل وتركيا كان رئيس الاستثمار هناك إدارة الأصول
they couldn t comprehend what i was talking about ما كانوا مستوعبين إطلاقا ما هم مستوعبين, they couldn t comprehend what i was talking about ماكن المستوعبين إطلاقا ماهم مستوعبين
فقلت you know what, فقلت you know what
i m not gonnna waste time اتصلت على تركي نفس الشيء فالعصر, i m not gonna waste time اصلت على تركي نفس الشاي في العاصر
اء قلت له here is the thing ابغاك تجي ومش عارف ايش, قلت له here is the thing ابواك تجي مش عارف ايش
قالي fine زي ردة يزيد ردة فعل يزيد بالضبط, تاليفاين زي ردت يزيد ردت فعل يزيد بالضبط
fine اليوم الثاني الساعة ستة الصباح حنا فالطيارة رايحين فرنسا انا وتركي ويزيد, فاين اليوم الثاني ساعة 6 الصباح احنا في الطيار رايحين الفرنسية أنا وتركيا يزيد
يعني هي both of them, يعني both of them
بالاضافة طبعا لسلطان ومهند they were believers يعني ماكان عندهم حتى معلومات كاملة, بالاضافة طبعا السلطان ومحمد يعني ما كان عندهم حتى معلومات كاملة
بس they believed in the cause, بس they believed in the cause
and maybe personally in me بالتأكيد ب اءء اااء اء سمو الأمير محمد,
we moved i remember لمبنى الصيانة فالمدينة الرقمية اخذنا نص دور سوينا أول شيء خمسة مكاتب كانت قزاز يعني أتذكر حتى كنت, we moved i remember لمبنى الصيانة في المدينة الرقمية خذنا نص دور سواء اول شيء خمسة مكاتب كانت اجزاز يعني اذكر حتى كنت
جبنا مقاولين خلص خلصنا أول شيء i think خلال أسبوع الخمسة مكاتب, جبنا مقاولين خلص خلصنا أول شيء خلال اسبوع الخمسة مكاتب
today we are تقريبا ألف ثمان مية وشيء قريب الألفين شخص, today we are تقريبا الف ثمية وشي قريب الـ الفين شخص نشتغل في صندوق الإثمرات العامة
اء مركو الملك عبدالله المالي اء one of the first tenants and i think, مركز الملك عبدالله المالي وووووووووووووووووووووووووووووووووووووووووووووووووووووووووووووووووووووووووووووووووووووووووووووووووووووووووووووووووووووووووووووووووووووووووووووووووووووووووووووووووووووووووووووووووووووووووووووووووووووووووووووووووووووووووووووووووووووووووووووووووووووووووووووووووووووووووووووووووووووووووووووووووووووووووووووووووووووووووووووووووووووووووووووووووووووووووووووووووووووووووووووووووووووووووووووووووووو
نفس القصة اللي صارت فالمدينة الرقمية ما كان فيه احد الان ال occupancy rate فيها تقريبا تسعة وتسعين بالمية او ثمانية وتسعين, نفس القصة اللي صارت في مدينة الرقمية ما كان فيها احد الان الاكبنسي ريت فيها تقريبا 99 و 98 
كلها بركات الصندوق الاستثمارات العامة وبالتأكيد رئاسة سمو الأمير انا if it wasn t for him none of this would have happened at all, كلها بركات صندوق السمارات العامة وبالتأكيد براست سمو الأمير and if it wasn t for him none of this would have happened at all
at all يعني,
hands down لولا الدعم اللي موجود والرؤية اللي موجودة عند سمو الأمير none of this would have happened ولا في مئة سنة, لو لا الدعم الموجود والرؤية الموجودة عند سمو الأمير none of this would have happened ولا في 100 سنة
الkpi s المؤشرات قياس الأداء اللي موجودة موجود فيها الصندوق, المشارات قياس الأداء اللي موجودة فيها الصندوق
يعني لما صارت الاستراتيجية والvision realization program اللي تفضلت فيه برنامج تحقيق الرؤية, يعني لما صارت الاستراتيجية والvisual realization program اللي تفضلت في برنامج تحقيق الرؤية
يعني لما تجي للأصول اللي موجودة اللي تم نقلها جالسين إحنا نطرحها فالسوق معظمها private اء, يعني لما تيجي الأصول اللي موجودة اللي تم نقلها جاسين احنا نطرحه في السوقت معظمها private
assets او private companies,
كيف نقدر نخليها جاهزة إنها تدخل للسوق so هذ هذي القيمة المضافة ب بالتأكيد, كيف نقدم نخليها جاهزة انه تدخل للسوق ها قيم المضافة بالتأكيد
يمكن هذي أبو فيصل كا chairman بس الصندوق وش اضافته الص الفلوس اللي جت من أرامكو جت للصندوق همم البيع ال ال المبدئي, يمكن هذي ابو فيصل كتشيرمن الصندوق نفسه اضافته الفلوس اللي جيت من أرامكان رجيت للصندوق البيع المبدئي
فا ااء اء هذا علاقة الصندوق في أرامكو overlapping spe5ech ok يعني الان اليوم يعتبر صندوق الاستثمارات العامة أكبر, فهذا علاقة الصندوق في ارامكو يعني الآن اليوم يعتبر صندوق استمرات العامة أكبر
ااء unclear shareholder بعد حكومة المملكة العربية السعودية, بعد حكمة المملكة العربية السعودية
ااء so هنا ال وعلى مستوى العوائد وين يمكن أنتوا صندوق استثمارات فأهم يعني مؤشر عندكم هو العوائد, على مستوى العوائد ويمكن انتم صندوق استثمارات فاهم يعني مؤشر عندكم هو العوائد
احنا و سوينا impairment على ما اعتقد إلى خمسين مليار من قيمتها, إحنا سوانا امبيرمنت على ما أعتقد إلى خمسين مليار من قيمته
يشوف وش الcash flows اللي تجي اذا هي ماهي بشركة listed, شوف كيف الكاشفراز الذي تجي اذا هي ماهب شركة listed
فكيف يقيمها يقول وش ال ال اء الcash flows او التدفقات النقدية اللي موجودة منها, فكافي قيم هاي يقول وش الكاشفلوس أو التدفقات النقدية اللي موجوده منها 
فلما تجي التدفقات النقدية اللي هي من الoperations من الfinance ومن ال investment, فلما تجد التلفقات النقدية اللي هي من الـ operations من الفاينانس من الـ investment
