gt,hyp
كنت في course احد الكورسات في في harvard اء اقابل, كنت في كورس احد الكورسات في هارفرت أكابل
رواد أعمال عالميين يتابعون endeavor طبعا انا تم اختياري في endeavor في الفين وثمانطعش, رواد اعمال حلمين تبعون اندفر طبعا أنا تم اختياري في اندفر في 2018
اء الأب الروحي للentrepreneur, الاب الروحي للانتربينور
تروح في امريكا تحس نفس انت ولا حاجة بالنسبة لهم وفعلا كنت في هال في هالcourse, تروح في امريكا تحسن أنت ولا حاجة بالنسبة له وفعلا كنت في هالكورس
اغلب ال يعني اء لما يبدأ يعطي history اني, اغلب يعني لما يبدأ عطوه هستريني
وش how much your raise انا الseries a كان اربعة مليون دولار, انا السيريس a كان أربع مليون دولار
بعدين series b مثلا كان قبل ما انا اسوي raise seriesb بس عندهم كان الseries a, هدين series b مثلا كان قبل ما انا اسوي ليس series b بس عندهم كان series a
اليوم صار فيه تضخم اليوم نشوف واحد يجمع seed, اليوم صافي التضخم اليوم نشوف واحد يجمع seed
seed round على خمسين مليون دولار في في أمريكا يعني ممكن بشكل سريع بما انك جبت طاري هذي الأشياء للي ما يفهم هذي المصطلحات, seed round على خمسين مليون دولار في امريكا طيب ممكن بشكل سريع بابانك تجيب طالح هذا الاشياء لللي مايفهم هاده المصطلحات
ايش يعني series seed round ولا series a ولا series b , اش يعني سيريز اه اه سيد راوند ولا سيريز اي ولا سيريز بي 
فيه seed round هو اول هو فيه ترا pre seed, فيه seed ground هو أول هو فيه طرف pre seed
أول شيء ما قبل البذرة ما قبل البذرة وعادة تأخذ الفلوس من friends and family اهل وأصدقاء الاهل وأصدقاء حلو فيه الseed, اول شي فيه pre seed وما قبل البذرة وعادة تاخذ الفلوس من friends and family الاهل واصدقاء الاهل واصدقاء فيه seat
الseed غالبا أهل وأصدقاء وangel investors يدخلوا فيه المستثمرين الجريئين, سيد غالبا برضه أهل الأصدقاء وانجيل انفسترز يدخلوا فيه المستثمرين الجريئين
حلو الملائكيين يسمون ايه بعدين الcsa هو مرحلة النمو, حلو ملايكين يسمون اي بعدين csa هي مرحلة النمو
يعني انت المفترض انه فالseed انت من الseed الى الa, يعني انت المفترض انه في السيد انت من السيد الى الاي
انت اثبت وجود mvb الفكرة حقتك والتركيز a النمو, انت اثبت وجود mvp الفكر حقك والتركيز اين نمو 
تستخدم فلوس عشان تبدأ توسع ايه تبدأ توسع تبدأ تنطلق جغرافي حلو b تبدأ مفروض انه extension للa, تستخدم الفلوس حتى تبدأ توسع إيه تبدأ توسع تنطلق جغرافي حلو b تبدأ مفروض أن extension للـ a
والb يكون عادة اء اء توسع لازم الg يبدأ الg care, والبي يكون عادة التوسع لازم الجي يبدأ الجي كيف
فأنت تتطلع انها تتوسع مو بس جغرافي حتى فالrbo, فأنت تطلع انه تتوسع مو بس جغرافي حتى في الاربو
فالaverage per per user فال تضيف منتجات إضافية and so, فالعادرش تريفينه per user فتضيف منتجات إضافية
طبعا c عادة c و d, طبعا c عادة c و d
يكون pre exit او pre acquisition او pre ما قبل التخ ماقبل التخارج ايه او الطرح ممتاز هذا تعريف سريع عالجولات انت, نكون بري اكزيت أو بري اكوزيشن أو بري ما قبل التخرج ايه أو الطرح انتهذا تعرف سريع الجولات انته
قفلت ال ال الجولة حقت الc الان لا قبل ايه انت قفلت a, قفلت الجولة حقا c الان لا قبل ايه قفلت a
وكانت هدفها النمو yes و وبعدين تكلمنا على موضوع svc وتأثيرها الفين وثمانطعش, وكانت هدفها النمو وبعد نتكلمنا على موضوع svc وتأثيرها 2018
الف وسبع مية مية الف وسبع مية sorry الفين والفين وثمانطعش ايه النمو صار two x unclear يعني حنا ننمو, 1700 1700 1700 سوري 2018 ايه النمو صار 2x year of read يعني حنا ننمو
عدد المطاعم و من عاد الش الmrr طبعا احنا كا, نحن يعاد المطاعم ومن عاد الامرار طبعا إحنا ك
باء في covid في عشرين عشرين فعشرين عشرين كم كان حجمها عشرين مليون دولار تقريبا عشرين مليون دولار, باع في كوفيد في 2020 في 2020 كم كان حجمها 20 مليون دولار تقريبا
بقيادة رائد بقيادة رائد عفوا لا بقيادة سنابل سنابل وstv, بقيادة رائد بقيادة رائد عفوا لا بقيادة سنابل سنابل استي في
سنا سنابل و سنابل وstv في series b ok طبعا هي لها قصة انه, sanabol stv series b okay طبع ا يلها قصة يعنى انه
اء اللي هي كيف بدأت الround انه, انه هي كيف بدأت الـ round انو
يعني انا برضو وصلت لمرحلة ان ما عندي احد يعطيني term sheet ويسعر تقييم الشركة الا شخص شركة وحدة بس, أنا برضو وصلت لمرحلة إن ما عندي أحد يعطيني term sheets أو سعر تقييم شركة إلا شخص شركة واحدة بس
اسمها stv ايه ماكانت كل الصناديق الثانية ماعاد تعطي ماتعطينا شركة اكبر صارت من اللازم, ايه كل الصديق الثانية مع التعطيل ما تعطين الشركة أكبر صارت من اللازم
و و bridgesعادة تعطي اء bridge, وبرجز عادتن تعطي برج 
i m pitching و بس كيف الفكرة اني, بس كيف الفكرة أني
اني قبل ال هذا كنت اتواصل مع جماعة process اللي هو naspersاسمهم سابقا, اني قبل ال ال ال هذا كنت اتواصل مع جماعة process اللي هو naspros اسمه اه سابقا
قالوا لي احمد احنا مبسوطين نبا نعطيك الterm sheet ولكن من شروطنا, بلول أحمد إحنا مبسوطين وبنبل نعطيك التربشيد ولكن من شروطنا
ونقابل physically الفريق الفريق والfounders تحديدا, الفريق والفاوندر استحديدا 
فجاة سمعوا قالوا انه الteam هون ما قدر يجي دبي لأنه سمعنا انه فيه covid, فجأة سمعوا قالوا أنو team هون ما قدر يجي دبي لنسمعنا انو في كوفيد
cases في دبي فاحنا مانقدر نجي قلت له طيب انا أجيك السعودية مافيها covid, cases في دبي فاحنا ما نقدر نجي قلتوا طيب انا اجيك السعودية مفيها كوبان
و وقت بدت فعلا العالم يطلع فعلا فيه covid, ووقت كارول بدأت فعلا العالم يطلع في كوفن
والناس كلهم فال فالرياض يقولون يرجعون اهلي يقولون ارجع ترا بيقف الموضوع serious أقول ايش سي ماهو موضوع وفعلا وقتها كان فيه, والناس كلهم في الرياضة يقولون ارجعون أهل يقولوا ارجعوا ترى بقف الموضوع سيريس يقول إيش سيريس ما هو موضوع وفعل ا وقته كان فيه
هنا عرفت ان الموضوع serious همم ونفس ال الجماعة هونوا يعني قالوا, هنا عرفت الموضوع سيريس ونفس الجماعة هونوا يعني قالوا
رحت عن طريق نيويورك عشان أمن نفسي اني ادخل السعودية وخلاص فالوضع كان serious, رحت عن ضريق نيويورك حتى امن نفس ان ادخل السعودية وخلاص فالوضوع كان سيريز
ما كان عندك الا stv ما عندي الا stv وفجأة طلعت لي سنابل سنابل توها تبدأ تتحرك توها تبدأ تتحرك وقتها, ما كان عندك الstv ما عندي الstv وفجأة طلعت لي سنابت ثو ه تبدأ الحراك واقتها
أتوقع كان اول transaction احنا سواه معانا اء وبدينا نشتغل معاهم والحمدلله انه, طوال كان اول transaction احنا سوا معانا وبذين نشتغل معهم والحمد لله انه
هنا ال انا دائما احب انه من تجربتي السابقة فال fundraising انه to create competition, هنا انا داما احب انه من تجربة السابقة في الفندريزن انه تكريوت كومبيتيشن
على الticket فتقول انت تب انت عارض مثلا عشرة مليون, على التكيت فتقول انت طبع انت عارض مثلا 10 مليون
الoversubscription هو اللي ارتفع الى عشرين فتعرض عشرة, الـ over subscription هو اللي ارتفع على 20 فاتعرض 10
من ال اء يعني مستثمرين وتبدأ تختار انت منهم وتبدأ تأخذ الterms وال evaluation اللي انت يناسبك, من المستثمريين وتبدأ تختارنت منهم وتبدأ تاخد الترمز والفاليويتش اللي انت ينسبك
وقتها الdelivery hero عطونا off term sheet, وقتها delivery hero عطونا offer term sheet
والdelivery hero شركة كبيرة اء وتقييم عطونا تقييم حلو, ودليفير هيرو شركة كبيرة اا وتقييم اعطوننا تقييم حلو
فا عرضت الterm sheet الى, فعرضت تلمشيت إلى
سنابل وسنابل they really match, سنابل وسنابل ذي ريلي ماتش اللي
الevaluation و وهنا هنا هنا شط هنا قوة الشركة , الvaluation وهنا القوة الشركة
فقفلتوا الround في وقت covid في وقت covid april كان ولا تقريبا ايه yeah almost تقريبا وقتها الevaluation كم صار , فقفلت الراوند في وقت كوفيد في وقت كوفيد تقريبا يا almost تقريبا في وقت هالvaluation كم صار 
حدود ال وقتها مية مية مية مليون مية مليون دولار yes yes, حدود الوقتها 100 مليون دولار
اعلى شوي وبعدها صار فيه تطويرات على موضوع المنتج صح بعد الجولة هذي yes yes بديتوا تدخلون في fintech, وبعدها صار في تطويرات على موضوع المنتج صح بعد الجولة هذي يس بدأتوا تدخلون في الفنتك
طبعا هدف foodics بديت يعني كنت we are pinching mark خلنا نقول with square, طبعا هدف فودكس بدأت من يعني كنت we are benching mark أنا نقول with square
فأمريكا square تقارنون نفسكم فsquare square payment وهنا اسمع انا انه صعب, سكوير وسكوير بايمنت وهنا اسمع انا انه صعب
تأخذ رخصة من sama والموضوع ماهو سهل فا قلت ويأخذ الprocess سنة, يتاخذ رخصة من ساما والموضوع ماهو سهل فقلت ويأخذ البروسس سنة
ناديت فريق الproduct عندي قلت يا ابا واحد منكم سلمته المهمة, ناديت الفريق الـ product عندي قلت يا أبا واحد منكم سلمت المهمة
ي يمسك ملف sama و sama ويقدم على الرخصة على أمل انه السنة الجاية نأخذها, يمسك ملف authentic وسامة ويقدم على الرخصة على أمل أن السنة الجاية ناخذها
بعد كذا ثلاث أسابيع دخل قال مبروك يا احمد عندنا اجتماع مع sama قلت له وش, بعد كدا ثلاثة سابيع دخل قال مبروك يا احمد عندنا نجتمع مع سامن وليس لوش
sama و تغير, سامة وتغير
فعلا وهنا الفين وثلاث الفين وتسع طعش هو من يوم اطلاق الsand boxing, فعلا و هنا 2019 هو من يوم اطلاق الساند بوكسنج
ودخلنا الsand box طبعا رحنا عرضنا الحمد لله, ودخلنا السانت بوكس طبعا رح نعرضنا الحمد لله
وقتها انا قفلت كل مشاريعي وكل أولوياتي وأول أولوية اني اتعلم اتعلم وش هو الfintech, وقته أنا قفلت كل مشاريعي وكل أولوياتي وأول أولوية أن أتعلم هتعلم وش هو الفنتك
اتعلم ايش الpayment اتعلم وش ال البنوك الbanking system بديت اعين مستشارين اتكلم, هتعلم مش البنوك البانكنج سيستم بدات اعين مستشارين هتكل م
وفعلا الحمدلله دخلنا الsand box و في عشرين عشرين, وفعل الحمد للله دخلنا للسانت بوكس في 2020
اء مع في منتصف الجائحة اء البنك المركزي عطانا الgreen light انه روح, اا مع المنتصف الجائحة بنك المركزي عطانا ال green light انو روح
دوسوا وزعوا الpoint of sale كان فيه initiatives انه to, دوسوا وزعوا الpoint of silicaan فيه initiatives انو تو
يمنعوا الcash cashlees وتركز على, يمنعوا الكاش ويتركز على الـ
على الpayment والحمدلله هذي فرصة كانت حلوة اخذناها للاستحواذ على العملاء, على البايمنت والحمد للهدي فرصة كانت حلوة خذناها للاستحواذ العملاء
فا فهذي دخلت ال ضمن الfoodics نعم اللي هي foodics pay نسميها الان, فهذه دخلت الضمن الآن فودكس نعم اللي هي فودكس باين سميها العام
foodis pay foodics pay foodics pay yes اللي هي يعني كيف طريقتها ok, food is pay اللي هي يعني كيف طريقتها أوكي
foodics الأساسي هو نظام الcasher نظام المطع المطعم ال مستودع وذا yeah فيه ااء, فوديكس الاساسي و النظام الكاشير نظام المطعم منيو في استودع في
ال ال الplan فالroad map أنه ندخل في foodics pay نصير نقدم, الـ plan في الـ roadmap اللي ندخل في فودكس باي إن سير نقدم
اء للعميل يصير خلاص one shop stop انه العميل يأخذ الpoint of sale ويأخذ, يصبح خلاص ونشوب ستاب إنو العميل ياخذ الpoint of sale ويأخذ
اء اء نقاط البيع من عندنا اللي هو المدفوعات الرقمية وبعدين يأخذ قروض عن طريق foodics capital, نقاط البيع من عندنا اللي هو المدفوعات الرقمية وبعدين ياخذ قروض عن طريقة فودكس كابيتل
عنده foodics online يستقبل طلبات online ومع التوصيل وكل شيء فهذا هو كان الطموح من البداية, عنده فودكس اونلاين يستقبل طلباته اونلاين ومع التوصيل وكل شيء فهذا هو كان الطموح من البداية
عشرين عشرين جاء covid وما شاء الله جاء covid سويناها كلها فيوم سنة وحدة ما شاء الله ايه اليوم تقرضون عملاء نعم بدينا عندكم ترخيص انكم تقرضون لا حنا نشتغل مع اء مع, عشرين عشرين شاكوفيد وماشاء الله شاكوفيد سوناكلها في يوم واسنة واحدة ما شالله فاليوم تقرضون عمر نعم بدأنا عندكم ترخيص انكم تقرضون لا حننشتغل مع مع مع
ونقرض up to خمسة مليون ريال يعني عن طريق بعض الشركاء و و برضو بدأتوا توسعون يعني انت كنت تقول, ونقرض ابتو خمسة مليون ريال يعني عن طريق بعض الشركة وبرضه بدأتوا توسعون يعني كنت تقول
في مقابلة عام الفين و واحد وعشرين انه foodics انطلقت من الخبر الى واحد وعشرين دولة حول العالم صحيح اليوم كم دولة انتم, في مقابل عام 2001 انو فودكس انطرقت من الخبر الى 21 دولة حول العالم صحيح اليوم كم دولة انتم 
اليوم حنا ترا حول الأربعين دولة أربعين دولة فالعالم foodics ايه foodics نعم واكثر من سبعة لغات مش لغة وحدة فرنسية, اليوم حول الأربعين دولة أربعين دولة في العالم فودكس نعم وأكثر من سبع لغات مش لغة واحدة فرنسية
امارات ومصر امارات ومصر اء طبعا بعد موضوع ال ال ال الfintech, امارات ومصر طبعا بعد موضوع الفنتك
اء يعني الأمور شوية تغيرت كا كا evaluation وكا potential بالضبط بالضبط فدخلتوا انتوا في موضوع الجولة الأخيرة هذي نعم, يعني الأمور شوية تغيرت كـ valuation وكـ potential فدخلت وأنت في موضوع الجولة الأخيرة هذي
اء وش اهم اللي حيختلف في foodics بعد هذي الجولة, وش اهم اللي هيختلف في فودكس بعد هذا الجولة
طبعا اء foodics pay الأساس هو ما هو بال بالنموذج اليوم قريبا ان شاء الله, طبعا foodxpay بالأساس هو ماهو بالنموذج اليوم القريبا إن شاء الله
حنعلن عن يعني الصورة الحقيقية لfoodics pay, هنعلن عن يعني الصورة الحقيقية لفودكس باي
اللي هي ال soft pos فيصير نفس الtablet, اللي هي الـ softbus فيصير نفس التابلت
الcasher لfoodics هو يقبل الدفع فأنت ما يحتاج عندك أجهزة أخرى ثانية, الكاشير لفودكس هو يقبل الدفع فما ما يحتاج عندك أجهزة أخرى ثانية
على أساس تقبل الدفع وعملية الربط والintegrations وال ال rela ما يكون يعني , على اساس تقبل الدفع وعملية الربط والintegrations ما يكون يعني
فيه عندنا مدفوعات عالطاولة table payment انت تروح المطعم, في عندنا مدفوعات على الطاولة table payment انت تروح للمطعم
تجلس فالمطعم تبغى تدفع فاتورتك فيه qr code تنسخه تلاقي فاتورتك نفسها تدفعها, تجهز في المطعم بتدفع فاتورتك في qr code تنسخو تلاقي فاتورتك نفسها تدفعها 
بدل مايجي الwaiter بدل مايجي الwaiter تدفع وتمشي please excuse me عطني وجه مرة, بدون ما يأتي الويتر بدون ما انا سبحت فريز اسفوزمي ولا حاج تدفع فضو تمشي مرة
يعني يعني يستفزني الwaiter اللي ما يكون منتبه ايه صح فتقعد, يعني يستفزني الويتر اللي ما يكون منتبة أي صحيح
ان الwaiter نفسه, ان الويتر نفسه
هذا رقم اثنين هذا رقم اثنين رقم ثلاثة ان نفس الد نفس الapplication, هذا رقم 2 رقم 3 إن نفس الـ application
الcasher مع الcostumer display العرض وانت فال booking, الكاشير مع الكستمر ديس بلي العارضة ونت في الوكن
costumer تقدر تدفع من الtablet نفسه بدون اعتمادية على اي جهاز اخر, تقدر تدفع من التابلت نفسه بدون اعتمادية على أي جهاز آخر
ال ال الdrive through and الkiosk فالآن foodics تقدم kiosk, الـ drive through and the kiosks فالآن fudex تقدم kiosks
اء في اي مطعم فيه kiosk كامل في نفس الkiosk تقدر تدفع, في اي مطعم في كيوس كامل في نفس الكيوس تقدر تتفع
تمر فالdrive through اء اخذت الطلب من الdrive through تطلع جوالك, تمر في drive through اخذت الطلب من ال drive through تطلع جوالك
ت scan qr code وتدفع, تسكان الكوركود تدفع
كل يعني هذي hardware ذي بتصير ولا هذي كلها hardware و payment طبعا احنا الخدمة الج كل خدماتنا القادمة اليوم, هذه هاردوير دي بتصير هذه كلها هاردوير وبيميل طبعا احنا الخدمات القادمة اليوم
احنا راح نصنع our own hardware, إحنا راح نصنع our own hardware
انه to control الexperience من a to z, أنو تكونترول الإكسبيريانس من أي تزد 
فأحنا مهتمين من الhardware,
ومهتمين فالsoftware المشكلة انه لقينا من تجربتنا السابقة فيه, ومهتمين في الصوفتور المشكلة أنه لقيانا من تجربتنا السابقة أنه في
اء انطباع سيء يأخذه العميل مو بسببنا بسبب والله limitation موجودة عالhardware, طبع سيئ ياخذ العميل مو بسببنا بسبب والله limitation موجود على الهارد وير
almost خمسة وعشرين الف خمسة وعشرين الف عميل همم بكامل بياناتهم موجودة عندكم صح ايش, نعم almost 25000 25000 عميل بكمل بياناتهم موجودين عندكم إيش 
ايش ممكن نطلع بtrends أو أو ملاحظات أو تحليل لهالبيانات تقدر تهديه, إيش ممكن نطلع بترند أو ملاحظات أو تحليل لهالبيانات تقدر تهديه 
لتطوير منتجات foodics, لتطوير منتجات فودكس
ماهي اء خلنا نقول garbage in garbage out هذي دايما أقوله فأي نظام موجود, ما هي خانا قول garbage in garbage out هال داما اقوله انه في اي نظام موجود
تعطيه بيانات اء يعني غير صحيحة يعطيك outcome غير صحيح, تعطي بينات يعني غير صحيح هيعطيك outcome غير صحيح
انا ودي والان بدينا بمرحلة والمرحلة تطوير هذي تحتاج وقت طويل ما machine learning يبغى لها وقت طويل, انا ودي والان بدأي المرحلة المرحلة التطوير هذه تحتاج وقت طويل machine learning يعني يبغى لها وقت طويل
فأحنا اليوم في مرحلة اء business intelligence phase, فاحنا اليوم في مرحلة business intelligence phase
اء نعرف وش أولويات وش الpains اللي موجودة عشان نبدأ, نعرف وش أولويات ووش البينز اللي موجودة عشان نبدأ
نسلط الضوء عليها ونطورها فلسا مافيه الان اي trends معين انتم شايفينها فالفترة الماضية, نصلة الضوء عليها ونطورها فلس ما في الان اي ترينز معين انتم شايفينها في الفترة الماضية
ال الback end وال wastege اللي قاعد يصير فاليوم اك نكتشف وموجودين وشايفين فالبيانات انه, الback end والويستيج الي قاعد نصير فاليوم نكتشف وموجودين ونشايفين في البيانات انه
فيه اء wastege هدر وهدر, في ويستج وحدر
و fraud بعد وين في الback end فالinfantry فالجرد اه فالمخزون, وفرد بعد في الـ back end في الإنفنتري في الجرد عمليات الجرد في المخزون
فالback end فالbo عمليات المشتريات, في ال back end في ال p o عمليات المشتريات
نقدم خدمة الsuppliers نو اء, نقدم خدمه السبلايرز
اء يعني نعطي الsupplier المواد مواد ال ال, يعني نعطي المواد
المطعم لي المطعم direct عن طريق foodics supply نسميه, المطعم دارك عن طريق food supply تسميه
فيه برضو بيانات اء الmenu engineering يعني اليوم, في برضو بيانات menu engineering يعني اليوم
يعني عندها اء يعني معلومات في الmenu, يعني عندها معلومات في المينيو
